Restaurant,Review,Rating,Label
Collage - Hyatt Hyderabad Gachibowli,I have visited this place for team lunch We opted for lunch buffet High expectations but all waste Ambience 5 Food 3 Buffet spread 2 5 Highly disappointed with the options available in buffet Hardly 7 8 options for both veg and non veg Taste was also not exceptional If you want to visit this place then don t opt for buffet go for Al cart ,3.0,1
10 Downing Street,Great ambience and food but cocktails could have been better I had pasta with white sauce and it was best i had in quite sometime However i was disappointed with cocktail I ordered LIIT but it was not as good as i expected but overall it was a good visit and i will Probably try something else next time ,3.0,1
Collage - Hyatt Hyderabad Gachibowli,I came here for a buffet The overall experience was average They have a huge spread to choose from only in the salads and when it comes down to starters and main course i was pretty disappointed because of pretty limited options i had to choose from even from which there was just a single starter that made me even think about seconds The deserts were decent i loved the chocolate ice cream Moving on to ambience the seating and the restaurant was pretty decent and i think the true look and feel could be experienced at its best if you were to visit the place for a dinner The service was pretty swift Food 2 5 Ambience 4 5 Overall 3 5,3.0,1
Asian Meal Box,A little bland for my liking ,3.0,1
The Glass Onion,It is a great place for a quiet dinner and ambience is lovely but the food was a disappointment the place doesn t feel like we are inside the noisy city which is absolutely delightful but I wish I could say the same about the food and drinks staff is courteous and serving time is excellent you don t have to wait for your food or drinks for more than 10 15 mins no matter what you order Ambience 5 5 Staff 4 5 5 Food 1 5,3.0,1
Ulavacharu,Visited ulavacharu with my son who are both non veg lovers The food was good but the quantity was very less for the price that was paid We ordered Raju Gari kodi pulav which costed around 400 and the meat was very less in it ,3.0,1
Mathura Vilas,Disappointed with their so called special Navaratri thali festival they did not have any other option of thali during this time and when asked about north indian or south indian thali they told that they have only special Navaratri thali we decided to order two of them Nothing special in this one by Navaratri thali you would expect kadhi khichadi and some good options but this was actually a mix of north and south indian thali utappam sambar payasam kela sabji mixture from South and tandoor roti puri corn n peas sabji tikki from north and small mixed fruits salad green chutney sweet chutney plain curd they had just plain steam rice They missed serving us welcome drink of chaas lassi Overall disappointed for the price paid and options received ,3.0,1
Pot Pourri,Staff is good and courteous but the food is pretty average Not a lot of options to choose from Nothing great Ambience also is pretty average ,3.0,1
Hunger Maggi Point,It s a very small food joint like a pan shop and very crowded since there are many other food joints in the same lane It s nothing exceptional but if you really love Maggi then you can give it a try We tried fried chicken maggi but are doubtful of it being halal If anyone knows about it please let me know ,3.0,1
Cascade - Radisson Hyderabad Hitec City,I have been this on last Sunday I booked from dinout i was expecting a lot fr this place scene it is a five stars hotel but i didn t feel that much good Quality of food is ok i can say as per my experience Specially if you are a vegetarian then it not a good place for you ,3.0,1
Urban Asia - Kitchen & Bar,I went to this restro yesterday for dinner with my husband to beat the monsoon dullness This outlet is in Gachibowli Rd above Ratnadeep store There are couple of other restros and to be precise its on the 4th floor It was little surprising as this restro share the common space with Eat India Company We did not have any prior booking but was amused as there were scarcely couple of diners in the weekend One of the staff directed us to a crampy place and we outrightly rejected his proposal The staff was rigid and told that the place where we wanted to sit with a nice view was already reserved We were also curt and told them that if we dont sit in a comfy area we have other choices Reluctantly they agreed but I was surprised that hardly two or three diners came while we were having dinner They could have attended our request in the first go for the feel good quotient Anyways let me quickly summarize the orders we made there 1 Crabmeat Soup This soup was thick with minced crab meat The broth was bland and you can customise it by infusing soy sauce vineager and crushed pepper The whiff of craby flavor will surely tingle your taste buds 2 Corn Cubes A must try out platter The dish was innovative The american corn flour was mixed with miniscule chopped vegetables Then the kneaded flour was frozen in small cubes and were golden fried It was crisp and at the same time had a jelly consistency 3 Chicken Yakitori I did not like this preparation It was very dull and tasteless There were six skewered chicken sticks with capscicum and onion The chicken pieces were succulent but did not imbue any flavor Main Course 1 Manchow Chicken Fried Rice The rice was flavorful and spicy with lots of veggies and diced chicken pieces in it It was a bit sticky and can be consumed at its own Dessert 1 Bangkok Custurd I was assuming that this dessert will be cold but it was just the opposite The custurd was hot and thick and made with coconut puree The thick sauce was decadent with loads of nuts It tasted like Firni As accompaniment there were thin crusty pineapple spring rolls It was just yum for the greedy tongue Total Rs 1396 Inclusive of taxes Cobclusion The price range is moderate and the portion is generous in amount The food is delectable but did not have any exlusive or signature dish which can attract guest for the next time The staffs are inexperienced and do not have knowledge abot the items put in the menu card No coordination among the staffs Either different staffs will come and ask for the same course of order for multiple times or no one will attend the guest The dessert section in the menu card is quite attractive but most of the items are not available I had a discussion on this with the manager but rather than taking it as a constructive feedback he delved himself into arguments This is not the place to enjoy your special occassions Its just okayish for casual dinner lunch I will think twice to visit this place again ,3.0,1
Karachi Cafe,Quality of food was average although the service of the staff needs a little improvement I had to wait for long duration even for a glass of water Potato wedges 4 5 5 Penne alfredo 3 5 5 Ferrero rocher shake 2 5 5,3.0,1
Driven Cafe,Nice place Coffee is nice Stays open till midnight which is great for people who work late night and are in need for a good coffee We had double chocolate decadent which is ok as we had better before Plus it doesn t look like it s made fresh Coffee was nice as it can get better ,3.0,1
Shanghai Chef 2,Its a casual place for good chinese food The ambience is a bit dull but the food is okay Service is ok Have been here on multiple occasions and have liked the food they serve ,3.0,1
Being Hungry,I had ordered thrice from here and each time the Chicken Dum Biryani was mind blowing Superb taste and with two pieces of leg pieces most of the times it s total value for money But unfortunately I was going to order it again and see that they have removed that Chicken Dum Biryani from the menu That s bad I really wish they put it again so that I can order it again ,3.0,1
The Foodie Monster Kitchen,Quantity is not upto the mark Rice or biryani is not even sufficient for 1 person,3.0,1
Cafe Eclat,So I ve been to this place with a couple of friends for breakfast so I d say that their bakery items are out of the world Freshly baked and you can see the chefs preparing them through a transparent glass Breakfast wasn t great would give it a 2 5 They use their own recipes and sauces Also most importantly it s a big hole to your pocket Very expensive So watch out,3.0,1
Shah Ghouse Spl Shawarma,late delivery,3.0,1
Mustang Terrace Lounge,Food drinks and music all is good What this place lacks is in service The servers literally forgot us and we had to call them multiple times and remind them to take our orders The ambience is great The view is superb They have 3 sitting areas indoor and two terrace sitting ,3.0,1
Feast - Sheraton Hyderabad Hotel,Sheraton is one of the best hotels in Hyderabad but their restaurant fails to match the expectations I have come here twice for the Buffet and the only good thing was some desserts They have very few options in Vegetarian starters Pizza is not of the best quality whole pasta is good Their desserts looks mind blowing but only few of them are actually very good Ambiance is pretty amazing but it s not the worth the price you pay for the kind of food you get here ,3.0,1
Hunger Maggi Point,I used to spot this shop opposite to the DLF IT park while coming back from work during my stay in Hyderabad Always crowded with majority of the IT people nearby and all other food delivery agents waiting to take parcel Got to know that they are also delivering till the wee hours of the night I was wanting to order from here once for that taste of Maggi Who doesn t like a fancy maggi noodles So one fine night ordered for a Corn Masala Cheese Butter Maggi through Zomato That was the most fanciest name I could find on their menu The delivery was smooth and the packing was okayish in a plastic box along with a plastic spoon and fork The maggi was somewhat soggy and some what semi gravyish which I am not that big a fan of It could have been a bit drier But the taste was really good and one could feel all the butter cheese in the maggi Good cost effective outlet for the love of Maggi Noodles ,3.0,1
Hyderabadi Daawat,i have ordered Veg Biryani from Hyderabad Daawat the taste is average and quantity is okay quality of the food need to be improved I do not see anything except cauliflower and beans in biryani ,3.0,1
Driven Cafe,The best thing about this cafe is that it is open 24x7 There are lot of beverage options a few bakery options and very little food options The ambiance is great for bike enthusiasts but if you aren t one it is only average for you They play really good music though The food is only average ,3.0,1
Mohammedia Shawarma,ddinot provide the mayo bowls,3.0,1
PourHouse7,I chose this place because a friend of mine recommended and I was pretty disappointed with the sluggish service as it was not even standard There was just one bartender on a Friday night which really escalated the waiting time Service on the food section was even slower As the fries ordered at 9pm were served at 10pm I was extremely displeased If you want visit pourhouse7 then I would suggest going only for dancing and that too only if you can tolerate the high base ,3.0,1
Hitech Bawarchi Food Zone,not much ecpected,3.0,1
Club Rogue,Ambience was good but when we were drunk the waiter has charged extra 100 on our bill Please ask the management not to misuse the customers,3.0,1
T Grill,Me my friend we re looking for quick lunch on a Friday noon in Financial Dist and we spotted this place Decided to venture as this will be our first visit It s was exactly at 12 30 noon when we entered restaurant and found there was hardly any one Outside landscape place for sitting is very good There is in house place with AC as well We chose inside as it was already too hot Ambience is descent and nothing very special but is good Food we kept it simple as Nawabi Chicken Kebab which was special on the day we visited and Chicken Biryani Kebabs were really nice Biryani was like fine Not so very delicious at same time it s not bad Service is fast While if you ask me will you visit the place again I might start thinking as I found place outside more interesting than the food That does not serve purpose So I am sure you got answer Interesting was by time the clock ticked 12 45noon my goodness entire place was filled with people and many we re waiting That made us think probably there is something else special about this place which we didn t order So if at all I go there next time will see to it I taste it ,3.0,1
Driven Cafe,Nice and relaxed ambience I won t mind chilling here for some time but that s it Food is very average and the service is ok hazelnut cold coffee is something you can try ,3.0,1
Club Rogue,Okay This place seems okay not so great Tables are too small in which we cannot put more than three food items And it was saturday night the DJ supposed to start at 8pm we were waiting for the songs to be played till 9 30pm yet no music nothing And we left the place ,3.0,1
Mohammedia Shawarma,Food taste was average,3.0,1
Gal Punjab Di,Food was really nice it was just traditional touch of punjab since I am punajabi so the taste especially rasile rajmah Management could work on more with ambiance n services amenities For food 5star,3.0,1
Collage - Hyatt Hyderabad Gachibowli,We were there to celebrate our anniversary There was a set menu Welcome Drink very refreshing tomato Shorba passable crispy paneer chicken tikka both were very yummy butter chicken paneer butter masala both passable daal fry yummy roti soft and steamed rice The pasta in white sauce was good But the absolute let down was the pan seared fish with tomatoes The fish was not done properly no crispy skin and was a bit smelly There was ice cream too The service was amazing and so was the ambiance ,3.0,1
GD's,Great taste but not worth it There is not place for dinning Open all night Fresh Can come with friends but not dinning as said Was full of cheese ,3.0,1
Green Bawarchi Restaurant,A place for a better and Spicy Biryani in Gachibowli Better than Paradise Worth to taste and have Biryani with Thumbs up Happy Eating The restaurant will not be crowded and one also cannot feel that ambience Better to take a parcel from this place ,3.0,1
Delhi-39,not bad taste li l more salty other wise good ,3.0,1
La La Land - Bar & Kitchen,Went out for a team dinner sizing 30 Had non veg starters and Biryani Limited desserts options Food was OK Ok 3 5 Waiters have no empathy for customers very rude late unprofessional in serving 2 5 Music was too loud very hard to converse with the team 3 5 Ambience is good but looked pretty aged ,3.0,1
Eat India Company,Descent place Nice and different Ambience Buffet was ok ok It started on a high note with Chicken Shorba followed by starters and main course And as we were moving to main course taste of food was not great It was either too much salt or garlic ginger paste All starters were really nice Mutton Rogan Josh was best Thai Green Curry with Steam Rice was delicious Desert we re hardly available and no one even bothered to refill Service was nice Over all ok ok May be second visit will think and decide if no option available ,3.0,1
Gal Punjab Di,Finally Found something in hyderabad that tastes like north indian food Tried the chilli chicken and thankfully it came without curry leaves Also ordered roomali roti which was quite large in size Packaging 4 5 Taste 3 5 5 Quantity 4 5 Will i order again definitely ,3.0,1
Yum Yum Tree - The Arabian Food Court,food was delivered cold,3.0,1
Aromas@11SIX,If you have no value for money then this restaurant is good to waste your money Reason for giving 3 is due to veg curries which were told be good by my vegan friends But we non veg guys were totally disappointed for non veg curries It s got no taste at all Chilli chicken gravy was like saucy saucy No spicy at all Butter rotis were thicker than it usually has to be It tasted like wheat flour and not maida Service Good Taste Below average Ambiance Good Cost High,3.0,1
Eat India Company,It was supposed to be a really casual lunch and we didn t expect this place to be nice but were surprised for sure So it s a nice restaurant with well arranged furniture and light Has a buffet lunch which is very convenient for Software professionals and casual lunches with friends I have small complaints which are listed in the end but apart from that I had a nice time So in the spread something that I loved dearly was the Chilly Prawns I just couldn t get enough of it It was amazing The chicken was alright But I can say but prawns were the best Although they were really small but can t complain much They didn t give us fish even after we asked for it Staff attentive and service was okay Ambience very nice place looks good clean effort was put in to make it look nice Food food was definitely good I liked it quite a lot apart from the desserts They were pretty bad Complaints Starting with the ice cream guy they have a cold stone ice cream He broke a water glass on the bar counter while making ice cream technically just mixing it and he used his already worn gloves and ice cream scoop to push the glass pieces away Didn t wash his hands or change his gloves or wash his scoop For all we know the glass pieces were still on his hands and scoop Second is also with the ice cream guy we found hair inside the ice cream he made us and returned it immediately Lost our appetite soon after that Third is with one of the waiters probably didn t want to give us fish even after we asked him to get us some which was on the buffet menu He agreed to get some but never showed up with it I hope it s his memory and nothing else that caused the problem Hopefully management reads this and takes action on it If those factors are avoided then will go again definitely ,3.0,1
Komatose - Holiday Inn Express & Suites,Went there with some work friends The place is cozy and attracts business crowd The food is good for bar menu The service could have been better We had to reach out to the staff multiple tomes to the extent of walking up to them to ask for stuff The ambiance is nothing to write home about but it is ok ,3.0,1
Triptify,sattu paratha was a bit spicy and they used sugar syrup in almond milk,3.0,1
eat.fit,not tasty,3.0,1
Absolute Sizzlers,I had ordered the smoked chicken pasta in red sauce I wouldn t say it was the worst but it was not up there There was no smokiness like the name claimed just bland chicken and rather a trail mix of vegetables that didn t really need to be there in it in the first place I would suggest revamping this particular recipe with lesser no of vegetables maybe cut the bell peppers and baby corn out Also the smoked chicken needs to be upgraded The spaghetti was also slightly overcooked ,3.0,1
La La Land - Bar & Kitchen,Seats and Tables in the center area are crooked Couches are comfortable but only for big groups Food Drinks at par with any other place in the area nothing special there Lights are almost perfectly dim Environment Ambiance is really nice They have Ladies Karaoke DJ nights too Service could be a lot better as in they put the food on the table and leave you be Hard to miss the place as its just beside Gachibowli flyover Enough parking space The place remains kinda empty on weekdays Service 2 5 5 Price 3 5 Ambiance 3 5 5,3.0,1
PourHouse7,The greek pizza was totally not worth rest was very good Taste of cheese fries and mushroom was best prices were too high which was not worth in many other dishes as well ,3.0,1
Karachi Bakery,It s a good chain of bakery here in the city well they give quite decent quality and quantity of food but only issue while ordering with Karachi bakery is the cheese burst sandwich french fries foot long get cold n looses the freshness for home delivery well I request to Karachi bakery to find an alternative for this ,3.0,1
Hunger Maggi Point,They are preparing good Maggi and their test of Maggi is also good but their prices are costly then other Maggi points also the quality is good,3.0,1
Tandoori Food Works,The first time I ordered their Chicken Tikka Biryani I became fan of it Loved it so much that I recommended it to my friends and colleagues as well The second time I ordered it the quantity was very less compared to the first time and tasted different as well I ve got the same sort of feedback from friends also that their food is inconsistent in taste quantity and its a hit or miss I would sincerely suggest them to be consistent in quality and quantity both as they ve got good potential ,3.0,1
T Grill,Ordered a nice dinner for two from T Grill The prices are mediocre and I placed my order late night via Uber Eats Following is my experience Service The parcel came in around 10 minutes later than estimated The delivery boy called once he was outside our society 3 5 Presentation Packaging It was a usual packing Nothing extraordinary nor anything bad about it 3 5 Food Food was fine but what really killed my appetite for it was the amount of chillies added We tried the following Paneer Pulao It had a nice quantity sufficient for two There were average number of paneer pieces It tasted quite yum The masala was ample inside Too spicy which killed it s essence 3 5 5 Gobi 65 A good quantity for two it tasted like a typical fried Gobi Nothing extraordinary the usual 3 5 Will I order from here again I will only if they decrease the spice level Despite mentioning it clearly as an extra special instruction it was supremely spicy which made me fill my stomach with water ,3.0,1
Cream Stone,Cool place which will be available till 1pm in HYD beat icreams and very unique especially they have wide range of varieties in chocolate types and service is also quite good except their GM singing in the outlet p,3.0,1
Deli 9 Bistro,When you hunt for nice place and meet folks who are just busy in their own it s a let down Staff really needs to pickup on the service and behavior not at all a nice experience Food saved this place the 3 star coz it was tasting decent not great again Not willing to visit again would give 2 5 if had a choice ,3.0,1
Frio Bistro,A sophisticated and calm place to eat I m a big fan of their Stuffed cheese steak chicken breast stuffed with cheese and spinach served with mashed potatoes and veggies The sangria was not up to the mark and the chocolate shake was also average I would definitely go there for their pastas and the stuffed steak ,3.0,1
Feast - Sheraton Hyderabad Hotel,I went here for a team dinner We opted got Buffet There is definitely a great variety on the menu but I did not like the food much It was just okay As you would expect delicious and ravishing meals from Sheraton that was not the case here Ambience is definitely 10 10 Maybe go for a la carte instead of Buffet Unfortunately I do not have any pictures ,3.0,1
Hyderabadi Daawat,not cooked property,3.0,1
The Foodie Monster Kitchen,Located in such a place where numerous food courts are available their menu is a real eye catcher Pocket friendly with decent quality quantity Talking about the taste we ordered chicken shawarma combo and rice bowl combo The taste of shawarma didn t reach our expectations but the rice bowl combo was really good Need to work on the shawarma cuz the taste levels of shawarma is pretty high Regarding the service the waiters were good humble the service was good but faced an issue with the payment Their swiping machine wasn t working so i had to go for an ATM which irritated me Management has to look after these issues Their ambience is good and clean Spent some quality time Food 3 5 Service 3 0 Re visit wanna try their whole menu ,3.0,1
Ulavacharu,Have been to this place after hearing lot of good reviews I can rate the food as very delicious specially pachimirchi Kodi Pulao accurately spicy varied dishes in the menu but I had a very bad day with respect to service First of all there were hardly 2 waiters who were available and even though it was not crowded they were unable to address the customers and were confused with the menu as once they said bamboo chicken was not available and then when ordered some other starter came back with bamboo chicken secondly after some time those 2 waiters were missing and the whole floor was left without anyone to take care of guests I hope that this is one of those cases and there wouldn t be other customers facing the same issue given the brand they own ,3.0,1
Pakwaan Grand,Date of Visit 17 05 2019 Items Ordered Chicken Haleem Chicken Biryani Service 4 5 Ambience 3 5 Hygiene 2 5 5 Taste and Quantity 3 5 Overall 3 5 You can give a try if you want a pakka hyderabadi cafe style ambience and food experience ,3.0,1
Komatose - Holiday Inn Express & Suites,Ambience is okay no dance floor average music No energized atmosphere A class place for people who want to drink in peace paneer was good peanuts were good,3.0,1
PourHouse7,Place is not so appealing as we went in afternoon and no one was there at this place There was dust all over the place as some construction work is going on Food is ok Ambience poor Reachability ok Overall experience 2 5 5,3.0,1
Shree Santosh Dhaba Family Restaurant,Ordered mushroom pander curry but received only mushroom curry taste was ok but order was not up to the mark please ensure it is not repeated again as it loses the credibility ,3.0,1
Hitech Bawarchi Food Zone,Hyderabadi Dum Biryani I ordered Chicken Dum Biryani from one of the outlet of Hitech Bawarchi online It was a single serve biryani containing a single large chicken piece Biryani was fully loaded with dum and basmati rice was used The quantity of biryani was more than sufficient for a single person Along with biryani salad Salan and Raita was served Biryani was packed in a good plastic container and carried in Hitech Bawarchi carry bag ,3.0,1
