Restaurant,Review,Rating,Label
The Indi Grill,Raza has treated us very well Good choice of menu options for the prices specified Good service done by Raza Wide range of menu options yo choose from Definitely must go place for food lovers ,5.0,2
The Glass Onion,Yesterday I was here with my two friends it was raining and weather was amazing The best fusion food I could ever eat It s a must go place guys I would rather say best place for romantic couples good view ambience of the restaurant good yummy yummy food and silent music The manager and people who were serving here are so polite and humble to suggest food and drinks I would like to visit again soon ,5.0,2
Momos Delight,I chose Veg Kurkure Momo s from this place after hearing lot of mouth reviews Momo s very perfectly fried and very crispy from out Filling was good Accompaniments of Mayo and Red chuney were sufficient and tasty ,4.0,2
Khaan Saab,The place is spacious ambience is pretty good It s a typical mughlai restaurant where you can find good north indian tase Coming to the food the variety in menu is too less The taste is good but as compared to price quantity is less ,4.0,2
13 Dhaba,Food was good,4.0,2
Udipi's Upahar,The best Coconut chutney and Sambhar in town Pick any food item and its delicious You can say that by the crowd at their place to get anything Must try Idli sambhar Poori Bhaji Butter pav bhaji ,4.0,2
Zing's Northeast Kitchen,My 1st visit to the place for lunch and i enjoyed their food We ordered lemongrass chicken it was nice but not strong lemon grass flavor though But the chicken stew with rice was awesome it was very light yet very flavor full I will surely visit this place again to try their Korean menu foodlove,4.0,2
"3B's - Buddies, Bar & Barbecue",Food is sooo yum Service is grt Met with shivam he was awesome with service in food and I enjoyed food in 3bs Mashroom was really good and pineapple was nice,5.0,2
Udipi's Upahar,good,5.0,2
Mustang Terrace Lounge,It s a good place with awesome ambience and a wide variety of dishes to choose from We booked a terrace lounge for our team out and have spent good time The staff are courteous and the service is faster than expected Would love to go again here Pros Ambience Food Alcohol Service ,4.0,2
Mustang Terrace Lounge,Been there on a Friday night and loved the ambience Place was not too much crowded Music and DJ was good and also the food This place is situated in a good location convenient for people working in Gachibowli We ordered LIIT and it was amazing Must visit ,5.0,2
Cream Stone,Very good concept and unique flavours My personal favourite is fruit exotica and tiramisu would certainly again and again just to have these two flavours Eagerly waiting for season special Alphonso ice cream ,4.0,2
Barbeque Nation,Great staff always ready to serve with smile celebrated our anniversary over there got exceptional service by Ravi Kumud and Chef Always take care of our spice level Love to visit again and again ,5.0,2
Hunger Maggi Point,Delivered before the time specifed,5.0,2
KFC,Took my friends brother for an early lunch meal on Sunday Restaurant was pretty empty and we had a pretty good meal Service was fabulous the kid spilled his drink and they offered another one ,4.0,2
Over The Moon Brew Company,This is one of the classier places to party in Hyderabad They have great music usually on Fridays and Saturdays when the party fever is high On Sundays though it s a bit mild relatively The food is good and drinks are even better Go there to have a good time with friends ,4.0,2
Shah Ghouse Spl Shawarma,The best shawarma you can have is here The quantity and the quantity both are awesome One shawarma is enough in terms of dinner or lunch I always prefer to have from this place,4.0,2
Banana Leaf Multicuisine Restaurant,The food quality in a la carte was kinda so so Kind of an average Budget restaurant The staff manner was very good Food quantity was good,4.0,2
The Chocolate Room,They offer a lot of varied products especially variants of Chocolate flavoured food Check out their shakes pancakes waffles pasta and lot more The ambience and service is great and makes you feel like spend more time ,4.0,2
Delhi-39,Yesterday I went with my friend for lunch first i thought this place is a not good Then my friend told me to test the food then say and believe me friends the food was too good We had D 39 Special paneer lababdar Spicy With butter pulka and mix fried rice with mix raita That all was pretty good And i specially like Special paneer lababdar Thanks team Delhi 39 for such a nice food ,4.0,2
Deli 9 Bistro,This is the best place to have a casual outing with colleagues during office hours Food tastes great Menu is very well defined and have good amount of combos My favorite is punjabi puttar combo with lachcha parantha do try that of you go here ,5.0,2
Shah Ghouse Spl Shawarma,quick delivery,5.0,2
The Glass Onion,Ambience is great so is the food Service is very fast Serving people are very polite and are easily approachable Food taste is great Their location in Zomato is showing incorrect It would be good if there are some directions put up on the road it was not easy to find through the map I would definitely visit again ,4.0,2
"3B's - Buddies, Bar & Barbecue",Overall experience was very goood Services offered by Shivam is excellent worth for the money and best place to spend time with buddies great food and great time ,5.0,2
Royal Spicy Restaurant,good,5.0,2
Shree Santosh Dhaba Family Restaurant,Good,4.0,2
Hyderabad Chefs,speciality restaurant offers signature Hyderabadi delights and north west frontiers dishes that make it an unforgettable dinning experience For over decades now this place has been serving food belonging to all the various places in the city With the richness in the dishes and the care with which they make it s an unusual experience,5.0,2
KFC,good,4.0,2
Olive Garden,Ordered veg thali for mother she enjoyed it but the quantity for bit low quality was good price also bit high will order once again some other dishes too,4.0,2
Paradise,Menu is good service is also good taste is good Biryani is good all items are good birya is having nice flavour staturs or good and lime shoda is good ,5.0,2
The Old Madras Baking Company,Undoubtedly one of the best bakeries in hyd I tried the Banana Cake Carrot Cake Choco Chips Cake Chocolate Muffin Love all of them The cakes are always baked properly Recommending this place for pound cake lovers ,5.0,2
Chinese Pavilion,Very fast service and the food is delicious Everyone must try the restaurant s food really loved the food Very tasty authentic Chinese dishes ,5.0,2
Owm Nom Nom,Ordered chicken fried piece biryani with an advice of my colleague after eating I am suggesting the same to my friends and colleagues to eat and order at own nom nom ,4.0,2
Triptify,packaging was excellent paratha could have been less oily taste was good ,4.0,2
"3B's - Buddies, Bar & Barbecue",Excellent food and excellent service vby bahadur ijajual and surjet we are very happy there service valso again visit soon love abs ,5.0,2
Labonel,Its a very expensive bakery not like other bakery they dont sell brownies and cupcakes in pieces they sell box of cupcakes and brownies The brownies are amazing very tasty they are soft and smooth Love it ,4.0,2
Tempteys,Sunday afternoon we visited this place with the bunch of foodies to experience their new menu which has been added recently Small outlet with around 15 people can be accommodated at a time Coming to the delicacy Classic shakes Poppy cherry and merry cherry were the two shakes which have tried Poppy cherry was just like butter popcorn shake was decent Merry cherry was simply outstanding and loved it Premium shakes Cruncy blue berry Caramel brownie were my favorites These are the must tried shakes at this place Exclusive shake Coffee hazlenut and cookie feast were delicious too Cheesecake was decent nothing that great Crushers Orange bright Poppy corn mint cucumber are some of the crushers which we tried but all were ok Fries Peri Peri Fries and Cajun spice fries were really outstanding and loved it Potato wedges this one was decent with Jamaican dips Overall there new menu is quite a hit and have some amazing exclusive and premium shake which is not too heavy on the pocket and tasty at the same time As we were invited here by management for the new menu session but will visit again for sure in future to taste other shakes and delicacies Must try dish Merry cherry Caramel brownie Cookie feast Peri Peri fries,4.0,2
Green Bawarchi Restaurant,excellent,5.0,2
Arena Eleven,Best place to chill out with few beers Went out on a sunday nyt here with my friends and it was just fun Inside outside sitting both are great Food is also good I go here now whenever i just want to chill ,5.0,2
"3B's - Buddies, Bar & Barbecue",Good service by Govind and feeling happy for the food and the management Food was awesome and expect others to come and feel the comforts one thing to add about the cleaness and everything ,5.0,2
The Old Madras Baking Company,One definitely have to try their coconut bun and cream cheese bagels Bread loafs are so fresh here and we can get variety of cheese Super place to hangout ,5.0,2
Absolute Sizzlers,Great place Awesome ambience and food staff is good and seafood delight is a must try also sizzling chicken come for budget lunch with your girlfriend ,5.0,2
B-Dubs,Wonderful place to chill out with buddies and can have fun part with PS4 gaming Food is really awesome and they have different sauces blazing is really hot should give a try Sunny was with us to entertain and giving good experience of bdubs,5.0,2
Kritunga Restaurant, ,5.0,2
Tiki Shack,We celebrated the a friends Bday and it was good The DJ was average at that time which was a little mood killing But the food and drinks are good The Bday boy almost passed out as we gifted him the helmet pop After which I dont think he remembers the next 24 hours ,4.0,2
Shree Santosh Dhaba Family Restaurant,good,5.0,2
Deli 9 Bistro,Must Try Beef Grilled tender loin steak and veg stroganoff it s just simply awesome One should come here for food in low budget but awesome quality ,5.0,2
Faasos,very nice service,5.0,2
Pista House,Yesterday we had a dinner at this place the food was good much taste we ordered kebab Chicken biryani and thum up the service was late but good we enjoyed,4.0,2
The Fisherman's Wharf,Every time I we visit this place it never fails to amaze with lipsmacking food A 5 service with 5 food taste Keep spreading love and warmth through your kitchen to our stomachs ,5.0,2
Olive Garden,Good lunch and buffet menu Loved this place Had been here a few times with my team for linch buffets So here goes my review Food 4 5 Ambience 3 5 Service 4 5 Budget 3 5,4.0,2
PourHouse7,At Gachibowli we have a new rooftop dining place which captures the astonishing view of Hyderabad s new side overlooking the mighty IKEA We dined at Pourhouse7 where they house a club too at the floor below the rooftop It was drop dead gorgeous view from there and the weather was cold with chill winds so we had to put our jackets back on But on a regular evening the place would be warm They have been serving us some nice cocktails and some punchy mocktails like chatpata masala The starters were not that great and needs much improvement They had chicken manchow soup and coriander soup which were really bleak and the place won t be expecting much orders on them as it s a bar The Hyderabadi Tawa Fish was exceptionally great and turned out to be my favourite of the night In the vegetarian department I ll recommend Tandoori Broccoli Further to the main course the Tangadi kebab was perfectly cooked juicy chicken legs The masalas of Cashew nut chicken and chicken tikka were soo tasty They were an amazing combination with the rotis The place has improve a lot on a handful of starters and rest will be taken care of Food 3 5 Ambience 4 5 5 Service 3 5 Value for money 3 5,4.0,2
Gal Punjab Di,Food tastes great for a quaint little place snuck in inner lanes of Gachibowli The place is lively with Punjabi music and the friendly staff As vegans that eat food with little oil and spice three of us had a sumptuous meal that comprised of Tandoori Aloo and Kebab as starters The initial order of a different kebab was sent back as the chef didn t comply with our little no spice request Our order of Aloo Parantha and Veg Kolhapuri came as requested however the Ajwain Laccha Parantha and Roti came laced with butter ghee The bread was replaced in 5 min or so as requested Aloo Parantha Combo came along with raita and chole We requested raita to be replaced with another serving of chole and the staff gladly obliged Barring the few delays due to non compliance of our requests we found the food to be delightful tasty and filling for a weekday dinner The shikanji was great too The staff are courteous but definitely could do well with internal communication with the chef s to ensure requests are fulfilled Go for it ,4.0,2
Karachi Cafe,An amazing cafe by karachi bakers each and every corner was used in a much different way a very retro theme was given with all the vintage pieces placed interior was very colorful and the yummiest part was the food i tried the pasta sandwiches which were just mind blowing A must try place ,5.0,2
Dunkin' Donuts,Yummy delicious and the pack of 6 for kids is very attractive We tried 5 6 varieties and all r good My nephew loved strawberry one They have many varieties of Chocolate donuts ,4.0,2
Chinese Pavilion,Went to Banjara with a couple of friends then to Gachibowli with family Wrote a review for Banjara just now but wanted to give one for This one was as well food is the same great thing I like the decor more here more modern than the Banjara place But same great taste and service ,5.0,2
Amul,supper,5.0,2
Squeeze @ The Lime,We used catering service from Squeeze The Lime for our kid s Birthday at our community premises We received compliments on food from most of our guests The service was good and there was issue even when our guest count was more than what we estimated We have chosen Squeeze The Lime for our Kid s B Day party as we found it very good when we attended few parties at roof top banquet It is the best place if you are planning to have a party with around 90 100 guests I look forward for another event with Squeeze The Lime ,4.0,2
T Grill,I just love this place Good Ambience it is very pleasant in the evening Away from the traffic and crowd it s a great place to organize any events especially in the lawn area The lighting adds to the elegance ,4.0,2
Green Bawarchi Restaurant,Supper job ,5.0,2
Feast - Sheraton Hyderabad Hotel,Awesome ambience and excellent food Wide range of food Salads starters main course fruit sweets everything was excellent Loved the experience Associate Rahul was also very helpful Will surely visit here again ,5.0,2
Tiki Shack,Tiki is well known place for its best drinks and friendly staff u will always love the food here and the ambiance is just simple it s a beach look located at very right place easy to identify great week endssssssss ,5.0,2
Yum Yum Tree - The Arabian Food Court,Excellent thank you ,5.0,2
SKYHY,I went to skyhy terrace lounge on weekend and it was great experience nice food love the ambience nice place to have photos good place to visit along with friends to dance asome cocktails friendly with mr london,5.0,2
Shanghai Chef 2,It s a small place with nice ambience and comfortable sitting The service was quick and people were friendly The noodles we ordered were okay and the veg kung Pao was good It s a nice place for a casual hangout and Chinese food ,4.0,2
Mazzo - Marriott Executive Apartments,Most amazing looking place in hyd a total refreshing relaxing ambience Rooftop lovers its a must try i m a rooftop place lover Every inch of the place is worth a picture I loved the burger esp I tried the thursday menu as i went on a thursday they served me yummy kodi fry kodi curry bagara rice and yummiest smeiya paisam with a moctail strawberry i had the best time i m sure u guys will too ,5.0,2
Green Bawarchi Restaurant,good ,5.0,2
Arena Eleven,Probably the best way to introduce you friends to arena eleven 19 299 399 299 20 20 20 399 20 20 30 20 20 30 30 30 399 30 30 20 30 30 399 399,5.0,2
Royal Spicy Restaurant, Not so spicy but totally lip smaking I was not sure whether i should order from this place or not With a semi doubt went ahead and ordered fish biryani and curd rice with coke And i must say it was a good decision i made The biryani was so good with nice quantity of fish 65 The curd was so creamy and good that i will surely order again from here ,4.0,2
PourHouse7,Decent food and good service our waiter subash was very nice and friendly his presence just improved the ambience of the place time well spent ,5.0,2
Cascade - Radisson Hyderabad Hitec City,I had a good experience with Radisson team and thank you for the host Salim Naresh Vilas enjoyed food and service thannks for your good experience Best place I suggest my friends,5.0,2
Hyderabadi Daawat,Excellent Taste and consistent taste This is my second time and love to go for Ambience and Taste Especially Chilo Kabab and Biryani also good ,5.0,2
Yum Yum Tree - The Arabian Food Court,Mixed Mandi So far the best one I had ideal for 4 to 6 people who r foodies ambience too gud service neee to be improved Seating good enough Loved it Try for the parties with ur friends ,4.0,2
Zing's Northeast Kitchen,The food is amazing Easily one of the best pork dishes I have had in Hyderabad The restaurant set up is like a cozy little shack and this along with the food transports you to another place entirely I m gonna become a regular here ,5.0,2
Dine O China,Visited with my friend on a lazy Sunday evening to satisfy our craving for authentic chinese food Ambience and service was really good Ordered sizzlers and some chicken noodles Found the both the dishes ordered to be sweet Liked the food overall ,4.0,2
Cream Stone,Had the best of icreams at creamstone We went there around 2 in the morning They have different flavours to pic from We had alfanso fruit exotica and ferrero rocher Exquisite desserts with unique taste I loved the alphanso They chopped these mangos over the yummy icecream Highly recommended ,4.0,2
Faasos,Firstly thanks to faasos for complimenting the food I ordered Their packing were good and the quality of food was also great The amount of chicken filled in the that eas huge where i couldnot eat one whole wrap For more details and posts please visit LETSEATHYDERABAD on Instagram Zomato ,4.0,2
Pista House,Visited this place a week ago with my foodie friends They had perfect hyderabadi starters which tasted awesome The malai kebab patthar ka gosht tai pei chicken were my personal favorites We Also had Butter chicken and butter naan The taste was just right Not so spicy at all Their biryani is famous so no doubt the biryani was exquisite Service was on point And the sweets were too yumm The double ka meetha and mango malai are the best among them Highly recommend this place For family and friends ,5.0,2
Hyderabadi Daawat,I happen to visit Hyderabadi daawat with family 14 members after long time v gotto taste authentic Hyderabad nawabi food sikandari raan kababs n soo on were js awesome Good service and decent ambience Sitting is super comfortable especially when you visit with family m planning to checkout other dishes as well a must try for Hyderabad nawabi kind of food lovers ,5.0,2
Mathura Vilas,Super place for vegans the food quantity is good enough quality is also great but the old boring music ambience is nice it is an efforable place for families,4.0,2
Zing's Northeast Kitchen,If you live anywhere in Hyderabad and you love eating pork and beef then this is a good place to try None of the dishes contains masala And the chutney given as complimentary with the main course is worth trying though it is very very spicy because of the BHOOT JOLOKIA Happy feasting ,5.0,2
Zing's Northeast Kitchen,The most amazing Naga beef I ve ever had The pork ribs are to die for The pork belly melted in our mouth Most of the dishes are tasty as hell Portion is kinda small but the price is correct for the portions Service is a bit slow One area they really need to improve is to get more and or better trained staff But the flavor of the food makes up for everything making me give 5 stars ,5.0,2
The Glass Onion,I don t see how this place can be rated anything other than 5 stars Food ambience and service is awesome There is no comparison to this place in Hyderabad I ve been served by Ani he takes care of customers and suggests great choices from the menu Personal favourites broccoli cheese kebab Non veg kebab platter Mezze platter ,5.0,2
Labonel,Having labonel brownies since childhood The best after Theobroma though P Chocolate brownies are my favourite Red velvet is also nice Tried marble cake also which is decent The best part of Labonel is its flawless packing Good for gifting ,5.0,2
Driven Cafe,Wonderful place to be with friends Recommend you to have the Caramel Mocha Tastes wonderful The coffee range is a very good range Cannot be compared to Starbucks but way better than Cafe Coffee Day ,5.0,2
Eat India Company,If it s Dal Bukhara in hyderabad it must be Eat India Company The hot and tantalising dal bukhara when rolled over a garlic naan with tinge of butter spread is an orgasmic treat to the tongue While the other items were good bukhara was the show stopper Missing bukhara in EIC is a big miss You may rather order just Bukhara dal and your palette has had its share of joy and would not ask for more ,5.0,2
Olive Garden,Was in Gachibowli recently regarding some work and landed up in Olive Garden for dinner after seeing their reviews Food was exceptionally good especially their crispy corn Even their main course items namely malai kofta and chana masala were very good All in all a very satisfying experience ,5.0,2
Driven Cafe,I visited here last week with my friend The pizza was awesome along with the dessert Pasta was fine along with latte The desserts are really good ,4.0,2
Tempteys,Extraordinary fantastic marvellous Best shake i have ever had A big thanks hugs n kisses to tempteys,5.0,2
Zing's Northeast Kitchen,I visited this place once and oh my oh my lemme tell you this place is ahmaaazing The food was amazing We ordered pork and it tasted so good just melted in my mouth I am salivating just by thinking about it Maybe there was just a little extra soy sauce in the food but however it was it was really good Highly recommended Will visit soon Chompchompchomp ,5.0,2
American Wild Wings,I absolutely love chicken wings so I had to try this new place in Gachibowli as I ve heard about it from a few friends I ve been to this place with a group of foodie friends This is a small outlet located on the first floor right above dirty burgers The place can host upto 30 pax max The place was bright and colourful with good lights all over the place Food We tried different sauces The Texas bbq spicy garlic Pattaya Thai original hot Mexican jerk and Amazon wild All of the wings were delicious and had varying spiciness The wings were slightly crispy outside and soft inside just the way I like them to be Next we were served with chicken nuggets and chicken popcorn The best munching dish I love till date are the chicken nuggets They tasted really good and were tastier than expected The nuggets were my favourite The chicken popcorn was not that great The presentation was not at all good and the chicken was very chewy Need to improve this Surprisingly the menu had biryani in it We tried their wings dim biryani The biryani was not that proper Hyderabadi biryani but had a good taste They served a really good quantity of biryani The management has to improve in their food presentations I personally liked this place and recommend everyone to do give it a try ,4.0,2
"3B's - Buddies, Bar & Barbecue",Starters are very good and servicing was excellent and good people around us and pleasant suraj had done good servicing for us and appreciable,5.0,2
Diners Pavilion,Great food never expected such a nice and spicy food in Gachibowli loved it place was pleasant to hangout with friends I recommend it strongly,5.0,2
Zing's Northeast Kitchen,I have been looking for good porks in Hyderabad n finally found it Pocket friendly and delicious food you would find over here Right opposite to SLN terminus quick service decent interior and courteous manner Pork ribs beef curry chicken momo the list goes on Don t miss this place ,5.0,2
Pakwaan Grand,Somewhere i feel like this n shah competes with each other one triesto deliver the best carrying both quality and quantity Seems like they ain t running for money but to feed us hahahaha ,5.0,2
10 Downing Street,Closed ambiance loud Food was filling we ordered veg platter and the pizza is a must try thin crust with a good amount of cheese if you re a cheese lover do try it Ambience 4 5 5 Service 4 5 Food 5 5,5.0,2
Karachi Cafe,good,4.0,2
Shah Ghouse Spl Shawarma,This place serves the best shawarma at the most reasonable cost Everyone should try shawarma at this place The shawarma is totally stuffed with chicken the fattest shawarma i ever had ,5.0,2
Mustang Terrace Lounge,I went to this place for Dinner I like the Roof top view it had and the ambience was good I orderd for couple of shots with Cosmopolitan cocktail and a Potato fry with garlic curry leaves and chilly flakes fried in olive oil and it was yummy served with maiones dip I somehow felt that the service needs to be improved and here is my overall rating out of 5 Ambience 4 2 Cocktail 3 8 Food 4 Service 3,4.0,2
