Restaurant,Review,Rating,Label
Beyond Flavours,Short review Decent breads and starters bad Shaam Savera a little screwed up daal makhni but should be a one off case Better ambience at night And importantly good quantity I wanted to give a 2 5 but that s not an option Extensive Ambience It s better at night Friends who had been here during the day didn t like it much So if you prefer ambience go at night Food Ordered a Hara Bhara Kebab Shaam Savera Daal Makhni rotis and raita Yes I m a vegetarian The good part Quantity I was excited to see Shaam Savera on their menu But take it from me you do not want to order it It is no where close to what it should be They messed it up real bad especially the colors The daal makhni had big chunks of garlic cloves which spoiled it for me It wasn t creamy too The breads and raita were decent The Hara Bhara Kebabs were decent too soft They had an extra outer coating of peanuts So if you re not a peanut fan on your kebabs ask them to skip that step Conclusion It looked like they had made food in a hurry Would like to give this place another try hoping that mine was one of the odd cases If things change you ll know ,3.0,1
Eat India Company,Ambiance 3 5 Decent place for family get together Comfortable seating arrangement boring music Food 4 5 5 The quantity and quality of dishes served are exceptionally great Service 2 5 Service was extremely slow Starting from menu to finger bowls to bill we kept calling the waiter and waited for 10 min after every order I was under the impression that after GST service charges are removed but i was charged additional 10 service tax Also AXIS bank offer as mentioned on Zomato site was not given by restaurant ,3.0,1
Olive Garden,Place was fine And the food was okay But i guess the people who served us was not sure about Zomato offers when you are a gold member It s good for buffet but I would not recommend for Zomato gold membership ,3.0,1
Desi Bytes,Litti choka chicken litti choka is the dish which one should go for in this place It drags me here every time and mesmerizes my taste buds A plate of it will full ones stomach Taste is quite good Quantity is sufficient Have not tried other dishes but would love to try them too ,3.0,1
Owm Nom Nom,Lime soda missing,3.0,1
Pot Pourri,Ambience and service is good Locality of the restaurant is good But taste of the food is not up to the mark Can make it more better Should improve the taste of their signature dishes,3.0,1
Dunkin' Donuts,To satisfy my donut craving stopped at this place Ordered some donuts and hazelnut iced coffee I d give a 5 for the donuts as they were delicious but the hazelnut iced coffee was bad it was very diluted and tasted almost like flavored water I love their donuts but drinks should be made properly too please look towards it ,3.0,1
NorFest - The Dhaba,Last time I ordered mutton rogan josh from here it was amazing but today it was not fresh and only bones no meat It s sad my favourite restaurant is going down in quality,3.0,1
KS Bakers,Had ordered rolls and puffs from here Extremely average or below quality Thou the packing was neat and all but the food inside was so so give Thee coz they are pocket friendly,3.0,1
Triptify,Ordered Gobi and sattoo paratha as lunch from here This came with dahi butter pickle and chutney Gobi paratha was soft and flavoured and sattoo paratha stuffing was too much and I dint like the taste much as I couldn t get the exact flavour of it The packing of this was excellent which came in a box packing using aluminum foil covering for paratha and every other thing well settled in the box Overall it was okay with the accompaniments and more than sufficient for one person ,3.0,1
Asian Meal Box,not so good I asked for spicy and Curdy but received a one with regular taste this this this this this this this this this this this this ,3.0,1
Amul,too sweet ,3.0,1
Marsala Food Company,Food was delicious But the ambience and the service provided were poor Every order took at least 40mins to be served Very poor cleanliness Not sure if I would visit again for a hang out ,3.0,1
13 Dhaba,The overall taste is good and I recommend Paneer Thali which is both reasonable and yummy But if you order paranthas then the North Indian taste that a parantha has is little missing Overall combos are good and Thali s too are nice option to go for ,3.0,1
Hyper Local,Menu needs a major overhaul Not for a large group of people Not for everyone due to limited items in menu Mocktails are damn expensive Ambience not as good as few competitors ,3.0,1
Sardarji's Chaats & More,have only one packet of curry instead of 2,3.0,1
Cream Stone,Cool place which will be available till 1pm in HYD beat icreams and very unique especially they have wide range of varieties in chocolate types and service is also quite good except their GM singing in the outlet p,3.0,1
Driven Cafe,This place is best for evening snack we had a milkshake and a cappuccino The walls are covered with great wallpapers and the cars and bikes in the restaurant area are speechless,3.0,1
Aromas@11SIX,Had ordered Hunan chicken starter received gravy,3.0,1
Hotel Zara Hi-Fi,It is sorry to say that no side items like chutney or salads were served with the order this time but only one pack of curd and little chops of onion with the order of two single biriyani Truly disappointed ,3.0,1
Delhi-39,Ordered a lot from this place and went for dine in a lot of times as well The biggest issue with this place is lack of consistency It is okay for the price range but the quality and taste of food will be a surprise almost every time We usually have Mushroom Masala Usually quite good with good amount of mushrooms Garlic Naan Nice and crispy Mixed Raita This has always been good In terms of ambience it has very less to offer and an okayish service ,3.0,1
Hyper Local,Visited Hyper Local for their newly launched Drunch buffet The buffet spread is valid for weeekends and costs nearly 1200 per person The place itself is located in a good open area inside SLN terminus and has both indoor and outdoor sittings to offer My experience with their food was decent The Drunch layout comprised of North Indian inspired starters such as Dahi Bhalle Dahi Vade Gol gappe as well as Papdi chaat I would have to say that they gave a decent shot to all these things My favorite of the lot was their Golgappe Speaking about their main course they had a really limited options consisting of Chole Bhature Veg Hakka Noodles Red thai curry Chicken pizza Steamed Rice Chicken tikka Chicken wings and Chicken pockets Looking at the price of the drunch I feel a bit more items should have been on offer Their Chicken pizza and Chicken tikka were simply delicious However they need to work upon their Thai curry and the availability of other items in the layout The best part about the place was the drinks section Loved the preparation of Wet Garden cocktail Sangria and Cranberry Cooler Special mention to the bar tender for a lovely range of drinks One can give a try to their drinks whenever you get a chance to visit the place All in all the experience would have much better if there would have been additional veg appetizers and a few main course dishes Happy eating ,3.0,1
Gal Punjab Di,i should say the ambience is excellent we ordered chicken jwalamukhi tikka which was mouth watering and yummy but the butter chicken was a let down i couldn t find cheese in my chilly cheese naan laccha paratha was ok shikanji is a mix of lemon and mint and people who like the combo will like that Lassi is thick and as Punjabi as u like,3.0,1
Karachi Cafe,The taste of Haleem was good but the quantity is not good for the price compared to others ,3.0,1
Barbeque Nation,This was my first time at a Barbeque Nation I ve heard great things about it people sounded like they serve food from heaven Now let me tell you about my experience at this outlet not going to judge the other outlets The service was not good we had to call em more than thrice to get the starters served the chicken tasted stale fish and prawns were amazing though They were serving complimentary drinks I selected ice tea worst one I ve ever had The good thing about this place their manager he knew we weren t happy tried his best to make things right for us made the chef come to our table which felt good and cared for I liked the ambience of this place will definitely give another chance to this outlet ,3.0,1
SKYHY,I had been to this place last weekend with family I must say the service is excellent Coming to the ambience the dance floor and the area beside that looks great but the rooftop wasn t that interesting 1 less star only for that But other than that the food was good but not that great We ordered 1 Budweiser 3 2 Virgin Mojito 2 It was soooooo good 3 Chicken Tikka Could have cooked more 4 Crispy chicken Asian Style 5 Dragon Chicken 6 Chicken pulao Same as Biryani nothing great Overall I feel a little more work to be put into deco on the rooftop a little on food But a good open air experience Best if you come as a couple The dance floor will be open to you ,3.0,1
KS Bakers,Truly average place Tried some of their puff pastry and they were good The items were fresh but the taste could have been better We went pretty late so didn t get a place to sit as they were in the process of closing down for the day ,3.0,1
Collage - Hyatt Hyderabad Gachibowli,I came here for a buffet The overall experience was average They have a huge spread to choose from only in the salads and when it comes down to starters and main course i was pretty disappointed because of pretty limited options i had to choose from even from which there was just a single starter that made me even think about seconds The deserts were decent i loved the chocolate ice cream Moving on to ambience the seating and the restaurant was pretty decent and i think the true look and feel could be experienced at its best if you were to visit the place for a dinner The service was pretty swift Food 2 5 Ambience 4 5 Overall 3 5,3.0,1
Squeeze @ The Lime,Vada Poha both were not good not cooked well Tetrapack juice as chosen was not given Food was not great ,3.0,1
NorFest - The Dhaba,I hv been away from Hyderabad from a year on coming back my brother told me about the dalnmakhni from this place he said it was amazing I ordered a couple of items along with dal makhni no doubt the dal makhni was nice but it can t be compared to d Delhi dal makhni The menu is very crisp overall the food is really nice I would rate this place a 3 5 ,3.0,1
Delhi-39,Lassi was not that good,3.0,1
Domino's Pizza,The order delivered was not so satisfying because the pizza was not enough hot to catch up the taste of it Hope i get it right next time when i order ,3.0,1
Eat India Company,The best thing about this place is it s aimbence Food was good would have been better for it s price Gachibowli branch is clubbed with urban aisa Zomato gold customers can take advantage of it Aimbence 5 5 Service 4 5 Food 3 5,3.0,1
Tiki Shack,Been to this place few days back with my friends Ambience was quite good 4 5 Service was okay 3 5 5 Food was average 3 5 5 We had ordered 3 non veg starters and 3 veg starters There weren t many good options for veg starters and something veg that we ordered were just average at taste And moreover that day there were only starters and main course was not available When it comes to music this was the best part The day we visited there was bhangra music Apart form Bhangra the dj was good was playing mostly bollywood music Overall if you want good bollywood music with not so great food you can surely try this place,3.0,1
eat.fit,For the first time tried the light lunch meal from Eat fit which has 450Kcal as mentioned Decent packaging with eco friendly cutlery though not happy with the plastic box Chicken chettinad was average as chicken could be softer and cabbage sabji seemed overlooked with excess of oil Chapatis were homely soft and warm something a bit hard to get in Hyderabad A less sweet ladoo was complimentary though some salad would have been better to make it healthier Not sure if I would order this again but could maybe try their salads ,3.0,1
Komatose - Holiday Inn Express & Suites,Good place to hangout in gachibowli Crowd was average but ambience wasnt what I expected either But good food not budget friendly but worth it as its so yummy Has a dance floor but we need to book it earlier it seems not open for all That s disappointing ,3.0,1
Royal Spicy Restaurant,I have ordered egg biryani from this restaurant Taste wise not that much superb But quantity wise it was more I will give 3 5 for taste But online order came very early I can appreciate for restaurant fast service ,3.0,1
Cascade - Radisson Hyderabad Hitec City,I have been this on last Sunday I booked from dinout i was expecting a lot fr this place scene it is a five stars hotel but i didn t feel that much good Quality of food is ok i can say as per my experience Specially if you are a vegetarian then it not a good place for you ,3.0,1
The Tilt Bar Republic,Food 3 5 5 There are very limited items to order especially in main course there was only butter chicken The mocktails were also just okay Service 4 5 They were good they knew their job well Ambience 3 5 5 It was good could have been more eye catchy but it was okay The singer sang very good songs had the mood up,3.0,1
The Chocolate Room,food was not fresh,3.0,1
Karachi Cafe,The perfect place to spend a rainy afternoon with your loved one This retro Cafe will rewind you back to the 70s Ambience is the USP of this cozy little cafe Old classics playing in the background would soothe you with nostalgia We settled for an Irani Chai coupled with Mawa cake While the tea was top notch the cake was just about average Service is very good Overall one of those places where ambience can pull you again and again,3.0,1
Desi Bytes,Litti Chokha This is actually they re known for back in Patna they re serving on of the tasteist litti in town But if we really see for something mouth watering near me With a budget of 90 bucks I really don t recommend if you re not in search of LITTI CHOKHA They re good but They can be much better I hope you ll know after tasting it once I don t really believe to spend 90 bucks for a litti Chokha when I m hungry and have more options in this price ,3.0,1
T Grill,Restaurant Food Ambience weather was sexy it was drizzling when I visited Drizzle made more exciting All Were Good Except Staff I almost waited 30 mins for Food Though I liked The Place ,3.0,1
Udipi's Upahar,good but not the best,3.0,1
Marsala Food Company,I have ordered mandi rice and fried chicken piece The rice is not up to mark and chicken is medium The gravys also not thick Over all the food is average and ambience is good ,3.0,1
Barbeque Nation,Friday afternoon We planned team lunch veg non veg in Gachibowli Barbecue Nation We were asked several times to give excellent rating by various attendants which was quiet annoying while we were having lunch even though food variety served was average and wasn t upto standard w r t taste variety In short it wasn t value for money I think it would be better to choose Absolute Barbecue over Barbecue Nation as customer you get value for money Seems like now Barbecue Nation is just riding on its legacy ,3.0,1
KFC,Hhsjoibohoogogigivigigu8gihohohohphpjpjpjjohohohohohohohohohohojojojpjpjpjohpjpjohohohohhjohojpjojohohohohohhohohohojojojojohohohigufufyfyfufufugkbkhkhkgigkghighihhohohih,3.0,1
Dine O China,The ambience is really good The staffs are very polite and their smile makes our day The service is quick and amazing The food was okayish Not that great though We ordered crispy honey chilli potato chicken dimsums must try burnt garlic egg rice and lemon honey chicken ,3.0,1
Collage - Hyatt Hyderabad Gachibowli,Had lunch buffet today but disappointed No choice of our food can t be ordered i mean other than mentioned in food menu Very less food options compared to others which have same brand level But ambiance is very good it s a pleasant peaceful Service is also very good they are very polite ,3.0,1
Club Rogue,Visited this place on a weekday afternoon and it was mostly empty But by the decor it felt that the place will look lively in the evenings so will give it a shot sometime Happy hours was on so we got Absolut for 150 Smirnoff was 70 which seemed like a better deal along with the other stuff Tried a couple of veg paneer starters Food was nothing to write home about but overall a decent and pocket friendly place for a quick afternoon round of drinks ,3.0,1
The Lal Street - Bar Exchange,It was a night out with gal pals When we entered the server took us to our sitting area we chose a corner as it had a couch felt it was bit secluded Warm indoors black and brown seatings cartoons of laal street their sensex of drinks prices being displayed in the TV They have their own app for ordering but guess what their wifi wasn t available as it was under repair That is what server told us The server came and took our orders We ordered starters and drinks As soon as he left we saw a rat running to hide somewhere It kind of scared us then we thought every place has them but still if its running freely what might be the state of infestation Then we started enjoying the music and our orders came The server got one of the drinks wrong we reminded him it was changed he said he already brought this Other places the server would have taken it back and would have apologized atleast Instead he said he cant take it back Anyways moving on The cocktail which i had were really good The cosmopolitan Beer trap and Screw driver The starters which we ordered the portions we felt were a bit small I can only talk about veg starters as i am a vegetarian Italian cheese fingers They were crispy and yum Stuffed mushrooms they were okay and forgettable the Nachos were okay have had better ones The crispy corn was good Last but not the least the soft noodles though good but felt the portion was even smaller than the other starters The music was good Being a bollywood night we requested DJ to play it first they said at 9 30 they will start then said 10 30 it will start We four were only on the dance floor we requested multiple times to play atleast one bollywood song He didnt oblige at all Would playing one peppy bollywood song really degrade his skills God knows Food and hospitality are an important criteria for any eating place be it a restaurant or a bar Hope they improve their hospitality That is one of the major reasons one goes back to one place again and again Food 3 5 Service 3 5 Overall experience 4 5 Because of friends VFM 3 5 5,3.0,1
Being Hungry,not tasty too sweet,3.0,1
Sardarji's Chaats & More,I ordered paneer butter masala paneer quality is best but gravy is not tasty ,3.0,1
Pakwaan Grand,Dal makhani and kadhai mushroom both were okayish Mushroom pieces could have been more Packaging was nice Delivery was a lot late though Overall moderate experience ,3.0,1
Owm Nom Nom,Taste is okay and ambience is just fine But my experience with service here is not satisfied Don t know whether I visited wrong time but to be honest cost and quantity is worthy ,3.0,1
Hunger Maggi Point,I ordered an veg corn Maggie which was okay to eat But the fried maggie s are much more tempting and more tasty The only drawback on visiting the shop is that they only accept the cash ,3.0,1
Shree Santosh Dhaba Family Restaurant,fine,3.0,1
KFC,Burger was okay But the chicken piece was not good and i was confused to find out which piece of chicken is that So please look for a good piece of chicken when people ordering through online or else KFC will start loosing customers ,3.0,1
Triptify,cheese chicken parotha ordered was not good thia time and didn t receive chicken shawarma parotha,3.0,1
Mohammedia Shawarma,bad taste,3.0,1
Zing's Northeast Kitchen,I read a lot of reviews about this place before visiting most of them read that the service is very slow I only realised it after I went there I was so tired waiting for my food that I only had starters here and went to some other place for dinner Food was no wonder very tasty We ordered drums of heaven and pork belly in chilly sauce It all tasted really nice I hope the place works on their service ,3.0,1
Ulavacharu,Rustic ambience was good The prawn and crispy veg starters were very average The Andra style curry was good Complimentary laddoo tasted yummy Overall decent place but nothing amazing as far as the food is concerned ,3.0,1
Delhi-39,tawa Roti s are very good and like home made I have ordered Kadhai paneer though there were only capsicum and onion with 2 3 very small pieces of paneer taste was good ,3.0,1
Pot Pourri,So I met my brother here for lunch yesterday We ordered spring rolls kaju paneer curry and butter naans The best amongst the order was the starter The curry was just okay with strong turmeric after taste The breads we ordered also arrived cold which made them difficult to chew Overall just an average experience Would have enjoyed if the naans were better and the curry didn t have so much turmeric in it ,3.0,1
La La Land - Bar & Kitchen,This is first time I arrivle at here it was great experience amince good food not so good overal nice experience Service 4 5 Food 3 5 Ambiance 4 5,3.0,1
The Lal Street - Bar Exchange,The DJ who plays at this place is really good We went in a group of 10 people and enjoyed a lot On the downside the food and drinks service is really slow and number of waiters are less as compared to seating strength of the place The people on bar counter suck big time as they don t talk properly give you respect and try to loot you by saying half of the low price drinks are not available ,3.0,1
Arena Eleven,It s during this time of the year where the cricket fanactics are on a lookout for places offering sports screenings and feel almost heartbroken not to find any dedicated sports bar in town But not to worry as Arena Eleven s here to woo the same crowd with their delightful sports themed decor offering big screen match telecasts for sports and all that coming with a beautiful rooftop ambience Located at Level 4 of SLN Terminus Mall in Gachibowli the tagline for the place is Kebabs Beers Sports each of which is incorporated in the menu as well as the setting quite aptly The menu for the place is particularly compact serving only a selective few Indian and Oriental preparations both in vegetarian as well as non vegetarian diets Sampling their vegetarian appetizer from the a la carte section we ended up calling for their Sizzling Veg Tikka Platter and Masala Fries both of which turned out to be pretty good The platter came with 3 different tikkas of our choice namely Veg Shami Peri Peri and Lemon Pepper Paneer Tikka on a sizzling hot plate with onions on the base Veg Shami was something that was absolutely mindblowing with a hint of heat both from chili and pepper with the perfectly soft texture Masala Fries was just a Indianized version of loaded fries with the crisp potatoes sauted in with onions ginger and garlic which worked as a good accompaniment for the drinks Non vegetarian section had some really nice dishes including the Tangri Kebab Lemon Pepper Fish Tikka and Honey Chili Chicken Wings which were just perfect for a setting of this kind My personal favourite was their Lemon Pepper Fish however for the juicy and succulent fish chunks giving that lipsmacking balance of citrus and heat from the lemon juice and black pepper marination Honey Chili Wings too were pretty good as a finger food having crispy fried wings tossed in a sticky sweet honey chili sauce probably the best candidate to be had along with a couple of chilled beers Disappointing was their Chili Fish however which had no flavour whatsoever bland pieces of fish with the coating sauce containing just chili without any seasoning The kitchen should probably revisit the recipe and take care in seasoning the fried fish with some salt and pepper Running a buffet on weekends the place offers a beautiful selection of mains to the diners having a variety of Indian options to choose from Each of the diets had two curries on offer with a choice of breads and rice where the non vegetarian sect had Chicken Curry and Murg Makhani along with some delectable Chicken Tikka Biryani After the disappointment in the starters it almost came as a surprise how good both the mains were Chicken Curry had the home style onion base with juicy boneless chicken bites added going absolutely well with some hot Tandoori Rotis Same was the case with Murg Makhani as well however it had a bit too much of sweetness for my taste Trying out their Chicken Tikka Pizza from the a la carte section turned out to be a disaster as the puffy base seemed to be store bought and stale which definitely didn t justify the price tag for the same The dessert options too gave little to choose from where we went for the Gajar ka Halwa and Rice Kheer both of which were plain simple average The service too wasn t any exemplary as the staff almost at all times paid no heed to the diners calling them out for help Getting even a glass of water turned out to be a huge task however on multiple complaints the restaurant manager did mend things well The kitchen deserves appreciation for sending out dishes fast into the dining room however in the pace they almost always lacked consistency The dishes we ordered at the start of the meal when again called brought something entirely different and dreadful on a plate All in all if the place provides a run of the mill menu with a some good dishes but lacking the consistency to deliver entirely instagram com,3.0,1
GD's,Ordered via Zomato Poor packaging the burger got squished The chicken and sauces were quite tasty though The packaging should probably be in boxes ,3.0,1
