Restaurant,Review,Rating,Label
The Indi Grill,Food is very good staff is very friendly and ambience is also good jilebi with rabdi is very good shakil and Raza were very friendly and served us with ease ,4.0,2
10 Downing Street,10D is my second home This places ozzes warmth and affection by the management and the staff A well kept place with great ambience catering to different age groups They have some gigs organized periodically The Brew beer here is awesome Best in town Kudos to Sanjeev Palavi I would like to highlight some of the friendly and helpful staff in house Johnnie Blessie We all call him John Johnny he is your go to man for any thing and every thing here at 10D Pradeep Pappu The most generous and helpful guy on the list of staff Keep up the good work ,5.0,2
Hyderabad Chefs,good,4.0,2
Cafe Eclat,We went for breakfast to cafe eclat on a Sunday morning We ordered spinach omelette belgian waffles coffee and gelato Everything was delicious but over priced for the quantity especially the waffles Overall it s a good place with happy vibes Just a little overpriced and the portions are small ,4.0,2
Flechazo,One of the best buffet experiences we had in Hyderabad The food especially the starters and desserts were out of the world The ambience and experience is unique The staff is very courteous and made us feel like we were at our family home Would like to call out Shabbir for the gracious hospitality Must visit if you are in Hyderabad ,5.0,2
Deli 9 Bistro,Its like a second home I have had dinner and lunch here like 25 times Very comfortable place to be at The food is good My favourite is paneer bhurji dal makhni and tandoori roti Love their pav bhaji Have tried almost all of their menu ,4.0,2
Gal Punjab Di,good ambience Tried Manchow soup roti dal makhani raita all were very good in taste I tried thali once that was also good and enough for one person ,4.0,2
Hyderabad Chefs,It s good tasty Good quality and quantity I order from this several times just once the quality was not good remaining all are sooo good Worth value,4.0,2
The Lal Street - Bar Exchange,A good place to hangout They have indoor as well as outdoor seating Live matches on big screens are quite engaging Starters are appreciable specially Tandoori Malai brocolli ,4.0,2
Hitech Bawarchi Food Zone,wow nice fast delivery,5.0,2
Paradise,Good Food and Tasty better to have music while having food better have quick response and everything other than these are good And good environment,5.0,2
Paradise,Biriyani is good and provided a good service and ur restaurant was nice and looking goodBiriyani is good and provided a good service and ur restaurant was nice and looking goodBiriyani is good and provided a good service and ur restaurant was nice and looking good,5.0,2
Tandoori Food Works,good,5.0,2
Hyper Local,The experience here was so good The managing staff were really polite to every single person the food was wayyy too good and the ambience was beautiful too Had a lovely experience ,5.0,2
Tiki Shack,Follow our Instagram page Hyderabadfoodbloggers Tiki shack is a popular watering hole in the heart of Hyderabad booming cyber district tiki shack comes into its own during the latter half of the evening and get packed to the brim in weekends the food was just amazing we order chicken pizza fries n many more it was tasty and flavourful i recommend u all to visit and a good place to spend time with ur friends rooftop bar feature a gorgeously LIT indoor inspired by Beach side shack as well as and alfresco section overlooking the busy gachibowli road ,5.0,2
AB's - Absolute Barbecues,Friendly people and enjoyed a lot Nice food and good ambience Bahadur rahman and vipal are superb and they served very well We celebrated anniversary,5.0,2
Karachi Cafe,If u r looking for a place to chill and relax this is the place Fruit juices are fresh Ordered bombay sandwich which was worth the money Ambience is nice and service too Overall Food 4 Ambience 4 Service 4 Can be re visited Yes,4.0,2
Squeeze @ The Lime,Real value for money One of the best places for vegetaraian buffet in and around hitech city Not much of rush Good service Decent spread Taste is also good Try their buffet ,4.0,2
Being Hungry,Food is nice as always ,5.0,2
Hyderabadi Daawat,Excellent Taste and consistent taste This is my second time and love to go for Ambience and Taste Especially Chilo Kabab and Biryani also good ,5.0,2
Pot Pourri,I ordered for curd rice really very very good and lip smacking The food is hygienic Maintain the same quality All the very best I m marking this as one of my fav place ,5.0,2
Hyper Local,Excellent Drinks and some great starters suggested by the courteous staff Superb Ambience Must visit for all and come long with family to have some good time ,5.0,2
Shah Ghouse Hotel & Restaurant,Good and polite delivery boy,5.0,2
Feast - Sheraton Hyderabad Hotel,I have been here for a Sunday brunch with family the food is very tasty the buffet has a wide variety and the spread is huge This place really busy for a sunday brunch as it s a big hit with its desserts ,4.0,2
B-Dubs,the place was really ultimate for watching ipl matches and food was really yammy drinks was superr i really like the place praveen yadav who servered nice and helpfull,5.0,2
Labonel,An excellent place with mind blowing taste I can say each and every item is of high quality and it s worth the price tag If someone is really tired of conventional desserts it s the place for you to try something new The taste will make you feel the fuming power of their tagline finebaking,5.0,2
Cream Stone,If you are an ice cream lover you might have already been here Cream stone is one of the best places to get many variety flavoured ice creams at anytime ,5.0,2
Yum Yum Tree - The Arabian Food Court,Had gone out with friends for a midnight craving and had the Mandi it was served on a huge plate and the seating was so perfect for us to help comfortably finish off the entire dish The rice was very flavorful and we were able to taste the ghee and cognitive milk in every bite A great place for a feast ,4.0,2
Hyper Local,Very fast deliveries quality and taste were very good be it veg nonveg Njoyed the big screen music dance floor drinks food ambience It was a ladies night on most of the fridays which makes the pub more lively as well You must definiely visit this on a friday night ,5.0,2
Cream Stone,Rich taste Exotic flavours It s my favourite place for desserts and birthday cakes Would definitely recommend everyone to try their ice cream cakes ,5.0,2
Frio Bistro,The place is not too huge or classy but it is good enough to have a nice peaceful meal Went for dinner and ordered a pizza and Arabiata pasta both veg Pizza was thin crust and it was one of the best crust I had in a while If you like the original taste of tomato then this pasta is for you as it retained that taste ,5.0,2
Green Bawarchi Restaurant,good ,5.0,2
GD's,Love their BBQ chicken and mercury burger Though service is little slow and eating area is small if you can manage to take away then this the best burger at its cost ,5.0,2
The Glass Onion,Why Glass Onion This place was trending on zomato ever since it has openned and it has gained the popularity in very short span of time So I was having an eye on it and finally felt delighted after visiting it at Saturday Night Ambience Oh Wobby Beautify ambience with indoor outdoor sitting options and spread accross huge space Its situated inside the boulder hills and hence the area is very peaceful and calm You need to have a reservation for outdoors as this place is mostly filled with people Service Food Super fast service and sumptous food Period From Kung pow chicken cheese based brocolli to Nachos to chicken chettinad everything is lovely and you can go on asking more and more Yay or Nay ,5.0,2
Cream Stone,super delevery,5.0,2
Cafe Eclat,This place is a hiddengem Went to buy their sourdough bread ended up having their mushroom soup death by chocolate cake and key lime tart Mushroom soup came with grilled sourdough everything was good about it The bread could be toasted with garlic butter The bread itself we ended up using as garlic bread with our pasta at home which was really good The bread is something we will go again to buy Lime tart Was better than expectation The cream was way too much Death by chocolate was delicious rich chocolate Was not able to finish in one go will have to get on it tomorrow again Highly recommend this place Will go their again for there sandwiches sourdough pizza and burger ,4.0,2
The Lal Street - Bar Exchange,It s a good place with bollywood mix music Good place for basic chill scenes with friends it had a decent dance floor good food and drinks,5.0,2
Beyond Flavours,Ahmed was a great help in beyond flavour He may suggest great food as he has good experience The staters and sizzler was too good The sauce that was use in the chicken dish was awsome Nan was very soft even if you take without butter you can easily eat Great experience in beyond flavors ,5.0,2
Royal Spicy Restaurant,nice delivery,5.0,2
Deli 9 Bistro,This is one of the best dining place situated near Wipro circle Since it s near by to our waverock site it s easily accessible good place to hangout Decent staff good food chicken steak is the one you must try would have been in this for more than 10 15 time trying out different food So every time we go we use Zomato Zomato code which one of the best option here but last time when I went they have removed it since the contract is over Wish you deli9 team should consider Zomato again which will allow to enjoy more food and suggest other Totally a good experience Food 4 5 Ambience 4 5 Service 5 5,4.0,2
Barbeque Nation,For ravi he is friendly Politely answering to questions Good in taste yeah it s very good everything is fine and the kulfi you don t believe me,5.0,2
Pista House,One of our favourite places for hangout The biryani is mildly spicy and not very oily which we really appreciate Kababs are great too Isnt very heavy on your wallet so we normally visit this place one every week when office s food vendor provides less than average food ,4.0,2
Khaan Saab,Good food and wonder ful service by Santosh Good location and spacious Loved the chicken kandhari and dahi kabaab Would definitely recommend this place ,4.0,2
Absolute Sizzlers,Simple place but very tasty sizzlers Portioning for the sizzlers are also excellent Service was also good I tried one of the chicken sizzlers and loved the plating and all the added stuff that came along ,4.0,2
Hyderabad Chefs,Good job,5.0,2
The Fisherman's Wharf,I Never knew i had such a great place near my home to chill out on weekends has really good beer non veg starters good ambience and quick service And the best Sea food in Hyderabad ,5.0,2
American Wild Wings,As it s name suggests the wings are mouth watering you can really enjoy the taste of tender juicy and freshly prepared chicken Lots of varieties in sauces and different kinds of wings are always pushing me to order from this restaurant Quantity of combos are huge I have heard ambience is too good I am looking forward to come for dine too ,5.0,2
Pot Pourri,We went to Pot Pourri As usual like a very good restaurant ambiance is really good Although I am not very big fan of South Indian food But hatts off to your chef food is really good We shall come back again ,4.0,2
"3B's - Buddies, Bar & Barbecue",Wonderful service by Shivam Good starters and a very affordable price The staff is very friendly and cordial The food is good and served well ,5.0,2
Karachi Bakery,There are times when one realizes how was my life going on without this That is what exactly happened to me when I tasted their red velvet cupcake It was heaven in my mouth I even got a half a dozen packed and I relished it everytime I put it in my mouth There was a vanilla cupcake too with chocolate frosting but the red velvet cupcake was just beyond awesome ,5.0,2
The Indi Grill,I had a team dinner on Friday night The food was really awesome mouthwatering we enjoyed lot with loud music here we got the amazing service by team Indigril For sure we visit again to this place Folk Must try The Indigril ,5.0,2
Frio Bistro,Great pizza decent rissoto But no wifi as mentioned Had difficulty using gold as there is no network would recommend this place to a friend,4.0,2
Owm Nom Nom,Delivered in time,5.0,2
Khaan Saab,It was a Thursday night that we decide to go to this Khaan Saab and get the feeling of being a Royal Guest The ambience inside and the interiors were definitely apt to their punch line it gives you the Royal Feeling We ordered main course only as we were way too hungry Butter Naan Punjabi Kulcha Chicken Kurchan Chicken Khandar First of all I felt the pricing was a bit expensive but for the ambience and the royalty of the place I would buy it if the food is also that good The Butter Naan had loads of Butter to our delight and were very soft and worth it The Kulcha had potato filling but we expected it to be a bit more surprising given it was Punjabi Kulcha Both the side dish had shredded chicken in gravy We were 7 people so while ordering when we ordered only two sides the waiter told us that one side dish suffices for only 2 or at max 3 people Given the price 380 we were amazed to hear this However we ordered only 2 and when the food arrived we understood why the waiter said so in the first place So we ordered one side dish later on and enjoyed the food The taste and the quality was really excellent for all the money However there was another thing which stopped me from giving a 5 star rating to the place We asked for the bill and everything in it was justified except the charge for water We had ordered regular water so theu gave 3 500ml Aquafina bottles and later on they gave a 1 litre bottle And they charged 150 for that in the bill quite ironical when the MRP is 10 for these bottles They charge GST and they charge water at such a idiotic price We clicked many pictures near the giant Elephant near the entrance The whole place was very well decorated and I could easily spend one hour just clicking pictures ,4.0,2
Royal Spicy Restaurant, Not so spicy but totally lip smaking I was not sure whether i should order from this place or not With a semi doubt went ahead and ordered fish biryani and curd rice with coke And i must say it was a good decision i made The biryani was so good with nice quantity of fish 65 The curd was so creamy and good that i will surely order again from here ,4.0,2
Over The Moon Brew Company,Amazing service by Kamal He was really quick with the service and appreciate his recommendations on the menu Keep up the good work ,5.0,2
Karachi Cafe,Place when you want to hangout for a chai with your loved one on a lazy day They serve fantastic Chai which goes well with Karachi s large variety of biscuits ,5.0,2
Dine O China,Dine O China is easy to locate The ambience is very good and the staff are very nice We were warmly welcomed and seated in the restaurant The menu has a lot of varieties We ordered for a 2 starters a fried rice and a dessert The food arrived on time and was very good Overall we had a delicious food and a good experience We will definitely revisit this place,5.0,2
Mazzo - Marriott Executive Apartments,This was my first visit to this place Hospitality is something that needs to be practiced and valued and Manager Mani mastered it Received a warm welcome from the staff Wonderful experience with the service and hospitality and food was ofcourse damn yumm Thanks a lot manager MANI for making my birthday special and most memorable,5.0,2
Over The Moon Brew Company,If you are a fan of brewery u should visit this place I have tasted three of there beers they taste good Food is very nice we ordered chicken and tandoori fish style murgh everything is perfect here Serving is also fast Zomato gold is additional bonus I felt they should allow stags on weekends on upstairs at least with a entry fee Rest everything is perfect ,4.0,2
"3B's - Buddies, Bar & Barbecue",Very good food with great ambience specially Govind s service was extremely good with very good behaviour who had a very good attitude throughout our dinner,5.0,2
Shree Santosh Dhaba Family Restaurant,We ordered Aloo Jeera and some of the pieces tasted stale it was like the old and new dishes were mixed ,4.0,2
Owm Nom Nom,If you love spicy food enrich with taste and good quality then this is the bestest place to have your food must must try is afgaani chicken and fry biryani and and kaju paneer as well ,5.0,2
Hunger Maggi Point,A roadside eatery to satiate sudden cravings for Maggi after office hours Can t vouch for the hygiene of the place but it serves some really good variants of Maggi Fried Maggi is highly recommend especially with extra cheese and butter add ons ,4.0,2
Hitech Bawarchi Food Zone,good one,5.0,2
Udipi's Upahar,good,4.0,2
Diners Pavilion,This place has the calm atmosphere and absolutely tasty food in a royal ambience The staff is friendly and suggestive of their good dishes ,4.0,2
Hyderabad Chefs,nice person,5.0,2
Olive Garden,very nice,5.0,2
Cafe Eclat,A must visit cafe with an amazing range of cakes and gelato They have a variety of breads to choose from along with coffee to opt The ambience and decor are top notch Their service is good I will definitely visit again tho the prices of the cakes are slightly on the higher end ,5.0,2
Faasos,Navratri review program I ordered sabudana meal and it was super awesome to get the special thali delivered in the navratri season with all the ingredients as needed for the fast The packaging was good and the order was delivered on time The thali has sabudana khichdi with loads of potato and peanuts curd sabudana kheer paneer makhni and a pumpkin chatpata chutney kind of curry Everything tasted good just that the makhni didn t go with the meal There could be rotis as well and the portion of khichdi cud be decreased The taste was no doubt best Fasoos has been doing great in terms of bringing the festivities and food together It was a little expensive though but it s worth it Unique menus are always welcome I am unable to attach all the pics though coz i already reviewed the delivery once which somehow got deleted Deserves a 4 5 Keep up the good work ,4.0,2
Sardarji's Chaats & More,I had food from this place many times I was glad when I found north indian chat in hyderabad Its not that good as we can have in north but still a good chat place as compared to others whatever I know Quanity 5 5 Quality 4 5 Packaging 5 5 Delivery 5 5,4.0,2
Being Hungry,Great,4.0,2
Aromas@11SIX,nice good,5.0,2
Shah Ghouse Hotel & Restaurant,Biryani is good but tandoor was not up to mark but still for non vegetarian this place is heaven Plenty of items at reasonable price ,4.0,2
Cream Stone,Very good concept and unique flavours My personal favourite is fruit exotica and tiramisu would certainly again and again just to have these two flavours Eagerly waiting for season special Alphonso ice cream ,4.0,2
"3B's - Buddies, Bar & Barbecue",Nice service from govind Chicken tikka and chicken wings are really very nice Pan ice cream and Bagodu gulab jamin also very nice Ambience was very nice and music also ,5.0,2
Yum Yum Tree - The Arabian Food Court,The best yum yum tree branch till date The chicken zinger burger is a must try A rooftop restaurant makes it best to hangout The ambience is great ,5.0,2
Behrouz Biryani,I like the taste but only drawback is that food is not serving hot like shah ghouse does,5.0,2
The Indi Grill,Great food with amazing service The variety in dishes is pretty good Loved the service by Mr Subendhu and Mr Upendra They did everything possible to make the experience great Highly recommend for office parties and big group dine outs ,4.0,2
Cascade - Radisson Hyderabad Hitec City,I ve been here for Sunday brunch being a fan of large buffets Strange I got what ever I want to eat in my plate as there are wide variety of dishes and customized food too One will expect Radisson will have continental spread with continental style but nah Radisson became a local guy with excellent local tastes too My biggest surprise with vada and Bamboo chicken biryani Vada with chicken curry bamboo chicken biryani with chicken gravy made my day Wide variety of desserts are to a special mention Hotel management is very friendly and helped to make our experience much better Most recommended place if you are a lover of buffets ,4.0,2
Marsala Food Company,Have been craving for their mandi after seeing so many pictures and hearing many good reviews And finally had a chance to try their mandi and other items from the menu Started with some hot arabian mutton soup One of the best and a must try here In their starters Chicken pahadi kabab hariyali fish tikka and golden fried baby corn were really good And also we tried this interesting item Mushroom moti tikka it was filled with kova Must try if u are fond of mushrooms And finally we tried their mandi Chicken fried mandi this has to be my new fav mandi Rice was flavourful and chicken was super yumm Mutton juicy mandi customised with fish fry fish were fried perfectly and tasted great Mutton piece needs a little improvement Was a bit hard In thier desserts kaddu kheer tasted good,5.0,2
Hunger Maggi Point,We can get a very good Maggi here I had eaten double chicken fried Maggi here it was very good for taste and look good for our eyes it was the best snack to eat,4.0,2
The Glass Onion,Truly a hidden gem This place is situated far from the city inside Emaar courtyard The have both indoor and outdoor seating and the ambience is the best part about this place Its just amazing The food was also great Something that good be improved is the customer service There is a bit of delay in getting the orders Top Picks Mint Cooler Chicken BBQ Pizza The ambience will offset the price you pay Overall a must visit place ,5.0,2
Mazzo - Marriott Executive Apartments,This place is awesome to spend midnight parts in Hyderabad very good service I loved it lovely view I enjoyed alot and price is reasonable,5.0,2
Hyper Local,This is a quite happening place with good food and perfect ambience order tawa fish fry and chicken tikka and pasta verry good service all so very good thanks Roshan coming agen,5.0,2
Jonathan's Kitchen - Holiday Inn Express & Suites,I was invited to this place by one of my friends to have a dinner and experience the hospitality that Jonathan s kitchen provide Let me talk about the ambience the place is very well designed and Maintained The lighting at the place is very warm and cosy perfect place to have a romantic outing as well as family time Now coming to food for the starters we ordered tiger prawns butter garlic prawns mutton sikampuri kebab crispy corn Out of all the butter garlic prawns were the highlight I d go back to this place just for butter garlic prawns For the main course we ordered beef steak and rice and dal tadka though I am not a fan of beef and I don t eat my friends told that it was too good Dal tadka was awesome Overall this is a perfect place to have dinner and lunch I d definately recommend this ,5.0,2
Deli 9 Bistro,Good place to have quick food to satisfy your taste buds Been there couple of times with some friends every time the food is good and service is prompt ,4.0,2
Yum Yum Tree - The Arabian Food Court,My first mandi dining ever But as the name says the food was yumm We ordered half special veg mandi and chicken bbq mandi The mandi is more than enough to fill three people and the cost is reasonable The Arabian theme ambience looked warm and inviting The add on point was the seating arrangement,4.0,2
Diners Pavilion,Look for some Italian food this place is good to hang out for Food was quit good and impressive as it s a value for money it s bit high from pocket but it s fine to spend on when you are good food lover Ambiance also is very good Food 4 5 Ambiance 4 5 Service 4 5,4.0,2
Hyper Local,The fisrt time i came here fell in love with the ambience The food is good and priced nominally Sandeep was so helpful in choosing the right choice of food drinks,5.0,2
Deli 9 Bistro,So i had been to this place like 3 months ago and we ordered chicken khou sey and chicken lasagna I was just soo yum that my mouth still waters thinking about this place I even loved the varieties of dishes in the menu happytummyishappyme ,5.0,2
Hitech Bawarchi Food Zone,gud service and on time,5.0,2
Hyderabad Chefs,food is good little spicy ,4.0,2
Dunkin' Donuts,Loved the ambience of the place Also we ordered a box of six classics and all of them were delicious Alongwith the popular chocolate ones do try the caramel strawberry and colour pop ones too Also do try Hot Chocolate Orange and Hot Chocolate HazelNut definitely a must try place for me ,5.0,2
La La Land - Bar & Kitchen,This place is a play of light and shadow Beautifully organized and carefully decorated with cushions and low height sitting areas We had lunch buffet and it was really nice Welcome 1 good looking and thirst releiving welcome drink with veg or non veg soup Starters 3 veg dishes veg tikki babycorn and hariyali paneer tikka 3 non veg dishes fish plates chicken wings and chicken kebabs Main Course It had wide spread of 5 6 types of salads 2 types of papad Veg biriyani Bisimille bhaat Bhindi fry Mix veg Paneer butter masala Veg Manchurian Veg noodles Curd rice Chicken Fried rice Chicken biriyani mutton handi chicken shakahari and fish gravy Desserts It had gulab jamun rasmalai firni 4 5 types of sweets 3 types of pastries ice cream and whole lot of fruits The experience was really nice and each and every dish came with awesome deliciousness ,4.0,2
Tandoori Food Works,The food here is just amazing 5 Hope to see more branches opening up I ve tried kebabs and curry and rotis it s just toooo good I definitely recommend this place,5.0,2
