Restaurant,Review,Rating,Label
Shah Ghouse Hotel & Restaurant,This is bloody disgusting I had to wait for more than 120 mins for my order And after that got a call for cancellation of the order If you can t sever the order let the customer know about it don t made him wait for a long time 120 mins of Sunday is precious for me To hell with your service ,1.0,0
Aromas@11SIX,Very very bad The food was not of good taste and quality as well It s like throwing money in water Just some fancy names they have kept for dishes but the standard aren t even like for petty shops In fact after having the food both me and my husband have got food infection Pls close ur shop instead of making people sick ,1.0,0
Momos Delight,food was cold and seems like prepared few hours ago,2.0,0
Mathura Vilas,Service Extremely Poor 1 Food Average 2 Ambience Average 2 Overall not a good experience We ordered for North Indian thali had to wait pretty long for it to come Finally arrived now to make it worse If we ordered for some more they took 20 mins or more to get the item They are so slow in serving you will loose interest in your food Welcome drink came after we finished having the starters such is their promptness ,2.0,0
Absolute Sizzlers,How do you expect me to be nice when the food I ordered when I am literally hungry came spoiled and the Zomato support people are not of any help I need my money back ,1.0,0
GD's,The paneer sandwich I ordered was not even grilled properly the filling was just too bland ,1.0,0
eat.fit,Had ordered veg pulao rajma it didn t seem fresh however I consumed it couldn t sleep whole night because of vommiting loose motion Will never order food from eat fit again ,1.0,0
Pakwaan Grand,food delieverd with wrong item,1.0,0
Olive Garden,very bad taste,1.0,0
KS Bakers,I had a grilled veg sandwich which is very good in taste and had a veg burger too Both of them really good and cheesy extra mayo as i requested loved it Ambiance not extraordinary but ok ,4.5,0
Mathura Vilas,Extremely disappointed with the service They delayed serving the food The staff is very lethargic and don t seem to care Save your time Go elsewhere By the by the pepper curry was the worst Don t try searching for this in menu for this dish It isn t there They added so much of pepper it felt like some chef s spontaneous idea which messed up our palate ,1.0,0
Diners Pavilion,The service was disappointing The servers were in some hot mess confused how to circulate the starters We were five members we got the table promptly as we had prior reservation We decided to take the buffet We were told that starters are being served pretty much like some other joints The sitting arrangement in the restaurant is haphazard mismatching furniture probably some kind of interiors they thought to make a different style statement which is not an issue for me The welcome drinks were served only for 4 members in the beginning Had to remind them to serve one more Only three plates were provided so after a wait of 5 minutes the rest two of us got our plates We told them almost 3 4 different staff members that two of us were opting for non veg and three are vegetarian They would either serve vegetarian options at a time or non vegetarian and then totally forget our table for 10 15 mins We had to remind them to serve us more Plus they kept bringing the same starter again and again despite telling us that there are other starters too For e g crispy corns arrived at our table I lost the count how many times Some starters arrived only once Some veg starters were cold Almost after 45 mins the two chicken starters that they told us in the beginning arrived Main course was alright After spending an hour my appetite was already gone I still made a selection of prawn curry it was delicious I had it with naan and some rice as well Desserts were also running out of supply by the time we were ready for it Overall the whole excitement of having a team lunch at this place was lost mostly due to poor service ,2.0,0
Green Bawarchi Restaurant,Worse They deliver wrong items and less quantity for orders No one from restaurant responded to call Zomato also tried to reach but still no response,1.0,0
Pakwaan Grand,I was ordered egg biryani but I was found a chicken piece in egg biryani how iam eat now The restaurant people is such a worst people nd west restaurant in That area ,1.0,0
Hotel Zara Hi-Fi,I didn t get any gravey item sherva how can we eat without gravey don t you have sense to send without sherva along without Biryani ,1.0,0
Domino's Pizza,still not received the order it s been 1 hour and 20mins ,1.0,0
Mustang Terrace Lounge,Worst customer service ever I hope this place closes for good They only destroy any good day you think to visit there I hope this review saves someone ,1.0,0
Absolute Sizzlers,The place serves below average food The place is supposed to specialize in sizzlers but that didn t taste good either To add up the waiters were totally clueless Utter waste of money ,1.0,0
Al Saba Restaurant,Worst biriyani it was got cockroach in water jug and no courtesy or respect to customer only starter is ok it was good once few months back ,1.0,0
Al Saba Restaurant,Waiters are very Rude and charge extra always check menu card before giving money to Waiters and No cleaness Management should be strict with the waiters ,1.0,0
Delhi-39,wrong items delivered can t call back delivery guy got a call from restaurant and asked not to open delivery guy will contact you but never heard back,1.0,0
Dunkin' Donuts,Unhelpful and rude staff According to Zomato they are supposed to be open till 11 but the staff gives excuses to not accept orders at 10 45 also probably because they want to leave early On top of that they have the audacity to behave rudely Don t visit this outlet ,1.0,0
NorFest - The Dhaba,Was served very bad quality of chicken even for the second time They mixed kebab chicken in butter chicken and 2 to 3 varieties of chicken were mixed and chicken is half cooked and had a very bad smell,1.0,0
Ulavacharu,The ordered Food was not good spoilt ,1.0,0
Desi Bytes,not bad,2.0,0
Asian Meal Box,food is awesome but delivered food after 1 30 hours late when called and asked they replied there are lot of orders this is not fare we waited almost 90mins for 20mins delivery,1.0,0
Behrouz Biryani,First the price is too high and the quantity I m getting is lower than the expectation You can see the cup it s so small like its just gave me for only to taste it And about the taste it s good I like it And I also got a small bread with this like who eats bread with a Daleem I would not recommend you to eat but If you just want to have a bite of taste then go ahead ,2.0,0
GD's,the item was not fresh prepared,2.0,0
Asian Meal Box,I ordered noodles with gobi Manchuria Trust me The noodles were so fat and without any taste The Sauces or the fry that noodles went through there was no taste at all in it It was not even having the basic salt Managed to eat with the gobi given in the box and later realized that there not more than 5 pieces of Manchuria Thus I could not even complete the noodles Was not at all satisfied with the noodles combo box ,2.0,0
Dine O China,Bakwaas chilli garlic noodles niether chili nor garlic taste,1.0,0
Urban Asia - Kitchen & Bar,I went there for lunch with an high expectation but i was a little disappointed with the food quality Veg food was good but for non veg buffet was little disappointing Restaurant had a nice ambience Till this all the experience was moreover ok but at the end when the payment part came they provided a bill without GST numbers ,2.0,0
Beyond Flavours,I liked the food and ambience but the problem is with the staff they are not so responsive we ve ordered one item but we got something else otherwise place and the food are good ,2.0,0
13 Dhaba,Quantity of the food is very less for a single person ,2.0,0
The Old Madras Baking Company,One of the best pizzas to try It served with the fresh crust and the topping of veggies are fresh and the taste of the ingredients was awesome and it is fully overloaded with Cheese I would like to recommend to try every Time I wager for pizza,,0
Deli 9 Bistro,Had a very disappointing experience here today We had been eyeing this place since long and planned our brunch to be had here Loved the place it was spacious and the ambiance was really good The first thing I ordered was coffee but they were not serving any hot beverages Next wanted to try pizza as they serve in different shapes but that too was unavailable Did not felt like ordering anything after this Highly disappointed ,2.0,0
Shanghai Chef 2,This place has lost its charm Went for dinner today Ordered honey crispy chicken and butter garlic prawns They served honey crispy chicken was waiting for butter garlic prawns After 40 minutes the person comes and asks for main course order I asked for butter garlic prawns he comes back after 5 minutes and says it s not available Pathetic service they take almost an hour to tell you if a order is available or not Better avoid it if these are the standards of this place wasting customers time,1.0,0
Eat India Company,Worst food ever Very bad taste i will give negative rating no dishes were properly made very bad experience Just name is big but no quality and taste Maintained,1.0,0
Shanghai Chef 2,I have ordered food online Veg Chilly Garlic Noodles and Honey Chilly Potato The taste was pathetic In chilli garlic noodles there was no garlic And Honey potato noodles they have made French fries and put a sweet syrup on it Looks like chief does not know how to cook this dish ,1.0,0
The Lal Street - Bar Exchange,This place is stupid and extremely discriminating As a guy you are not allowed to enter the dance floor The bouncers are hostile and say that unless you have a girl you cannot enter the dance floor I understand there might be instances of guys Misbehaving but the attitude of the management towards people is extremely hostile I m never coming here,1.0,0
The Fisherman's Wharf,Very slow service it took us more than 2 5 hours just to have dinner Totally disappointed with respect to the amount of money they are charging ,2.0,0
Pakwaan Grand,it was coated with full oil can t even eat happily,1.0,0
Karachi Cafe,Delivery boy said that he met with an accident Food got spill out of packed box,1.0,0
Sardarji's Chaats & More,They have reduced the quantity a lot ,2.0,0
13 Dhaba,Ordered butter naan Completely jalgayaaa and very very difficult to chew and eat Not at all goood Panner makhani is also not al good ,2.0,0
Mohammedia Shawarma,Please be advised of the tasteless crap load sold as shawarma Filled with vegetable and nothing but tons of vegetables to make sure you won t complain Perfect for one on diet or a vegetarian as they don t use much chicken Its just roti filled with cucumber and tomato kudos to the chef ,1.0,0
Club Rogue,Very unprofessional and rude staffs If you order 2 beers they will insist for a bucket and if you do not order a bucket they will take half an hour to bring your order The place is overcrowded during weekends and there is no proper crowd management of any sort Then the waiters say that because it is overcrowded orders can t be processed properly Despite all that inconvenience and bad service they force you for paying the tip and even argue over how much you want to pay Crowd is very indecent and sometimes vulgar and there is no provision for crowd control given that the place is overcrowded Music and DJ is good with cheap food and drinks which is a crowd puller One can have a really nice time if you can bear all these and if crowd is what attracts you ,1.0,0
Ulavacharu,Ordered Gadwal Kodi Pulav it had no salt No resolution on it even after complaining that it had no salt The quantities served are very less so everyone who think one Pulav will serve two to need to order one for each ,1.0,0
Hyper Local,Shame on the management don t even consider the regular customer benfit Please do close it shame on you ppl please don t visit hyper local any time ,1.0,0
Marsala Food Company,Food was cold and hospitality was bad Had to wait for soo long to get food Prefer going to other restaurants than this Had bad experience ,1.0,0
Al Saba Restaurant,Another place fo delicious Hyderabadi rum biryani and irani chai There are numerous places across city for dum biryani and this is one of thr best Although the spices used and cooking process is same every biryani in different in its flavour This is a pocket friendly place available late night Both Chicken and Mutton biryani are good and they also serve fish biryani here which is also a must try dish Kebabs are also very good here Coming to ambience its a huge place with chai cafe kind of ambiance but they also have AC hall for family section Service is the only terrible thing here Even during the peek lunch time they say biryani is over and fresh hundi is awaited which is terrible I mostly do take away here which is a better option Taste 4 Ambience 3 Service 3,3.5,0
Diners Pavilion,We had a team party of around 40 people and the service over there was pathetic We took buffet for all but for each starter they where taking atleast 45 minutes when asked the waiter s they use to tell will get in 2minutes which never comes because of which we had to directly jump to main course and leave the place Food 1 5 Ambience 3 5 5 Service 0 5,1.0,0
Marsala Food Company,The food of the place was nice except for Murg Malai Tikka the dish was very sweet and not worth for money The reason for giving 1 star rating is my experience in the restaurant which was not only food but also the staff which were very very rude not only while serving food but also while taking order and explaining certain dishes which were named differently on the menu The staff doesn t know how to treat with customers they were unnecessarily speaking and poking nose in our personal conversation and behaving miserably with the people there pretending that is cool behaviour Overall good place to order food from the last place one should go for dine in The staff should learn how to behave with the customers 1 star is also too much depending upon how the staff behaved with us last night when I went with a group of friends ,1.0,0
Komatose - Holiday Inn Express & Suites,Booking a place here for a corporate package is absolutely horrendous They provided the menu and package details on Friday and confirmed its available and on Monday the day of the event Management was rude and was insisting they ll not provide the buffet but will charge the same price as per the package They did not have minimum courtesy and were not even respecting the fact that our manager a lady was trying to talk This is probably the worst ever team I had ever talked to Very disappointing This has resulted in cancellation of our corporate party which consisted of several partners and managing directors I d never recommend this place to anyone ,1.0,0
Shah Ghouse Spl Shawarma,shawarma is not tasty need to improve in taste,2.0,0
Mathura Vilas,I have been to this place for random dinner with friends and it was the most stupid decision The place is the perfect example of mismanagement The food was also pathetic We have ordered sambhar rice after a lot of disappointment thinking that atleast it will come on time and will be good in taste but I guess they were checking our patience and it took almost 20 25mins for us to get that They were so slow even in providing bill and on top of that they have added service charge without even our notice I have given two stars only because the manager owner not sure was really very courteous and he has asked not to pay by acknowledging our complaints ,2.0,0
The Glass Onion,It was a busy day which turned into an unplanned dinner at this place I reserved a table for us on the same day itself To start with i really liked the ambience of this place and the view which it had I was delighted to see the place at first Contrarily i was dissapointed as there were initially no one to recieve us after reserving the table and then we ourselves had to ask the management to set up the table for us as expected every other waiter was in a hurry and they set up an eneven table for us in a shabby manner like local restraunts and they gave us the menu The waiter had no idea abt the dishes and its contents we asked abt a starter which was made of lotus stem for which he just nodded his head for watever we said I would say the food was not really upto the mark and the prices were on the higher side the food was not worth the price it tasted more like any other local restraunt The starters being prawns and another vej starter which was made of lotus stem were below average Coming to the main course we had ordered the butter chicken curry with rice I would say the butter chicken tasted very bland it was sweet and barely had any flavour seemed like they just boiled the chicken in a sause and got it for us overall a bad experience verdict on the face of it the ambience was nice the service and food were not upto the mark Very dissappointing indeed ,1.0,0
Absolute Sizzlers,Bad food bad ambience bad service clueless waiters and expensive food Such a waste of money Everything was bad I regret going to this place ,1.0,0
Being Hungry,Delivered cold food food is not even warm ,2.0,0
Asian Meal Box,I have order pannier 65 with egg fried rice and one extra egg m paid for those but I m recived only pannier 65 with egg fried rice not recived egg but I m get bill from restarent include with extra egg,1.0,0
Green Bawarchi Restaurant,worst food actually I ordered chicken chilly gravy but he sent chicken manchuria and people don t prefer this restaurant ,1.0,0
Hotel Zara Hi-Fi,The food was very spicy ,2.0,0
Behrouz Biryani,I never received this order 21812387 today No one contacted me I asked Zomato chat rep to have someone contact me regarding this issue Please call me after 3 PM IST I have registered my compliant on twitter handle how can you mentioned without verifying with me that it was delivered No follow up done from Behrouz Very disappointing Please refund my amount See the rider is still on the way pic ,1.0,0
Hotel Zara Hi-Fi,Food delivery was taken 1 hr 10 mints and food is very high spicy unable to eat so we have thrown in dustbin Worst experience with this restaurant ,1.0,0
KFC,Never go for potato krisper burger bad taste and these guys add imli chutney in it its taste like what the hell we are eating Never go for this,1.0,0
Shah Ghouse Spl Shawarma,Delivery Review Ordered a Chicken Rumali Shawarma The chicken was so hard that it was very difficult to chew Also the spice levels are very high so please add an extra note if you want less spicy Overall it was okayish Had to throw away half of it as both Rumali and the Chicken were very chewy Giving 2 star because they didn t add mayo as requested Overall it is just okay and you can definitely find better ones in the city ,2.0,0
Being Hungry,too much spicy tastes like Manchurian not good,1.0,0
Tandoori Food Works,very less quantity for a regular that i ordered it cant even feed one person and they are charging 300 rs for this qty Though the taste is good but quantity is very less still hungry and had to order from another restaurant,2.0,0
Hotel Zara Hi-Fi,I got stomach ache Too spicy please mantain quality,2.0,0
Desi Bytes,packing serving presentation was not good it could have been done in a better way in order to maintain the food authenticity presentation and the taste i have ordered chur chur naan combo and it was like as if i am eating some aalloo halwa and portion of daal and raita you serve is very less for that naan ,1.0,0
La La Land - Bar & Kitchen,Just now had a buffet lunch and right now in restaurant only and writing this review Not much option for vegetarians Service is pathetic as we have to ask for starters and they are not serving and waited for 10 mins and had main course After that they served remaining starter Dessert were not at all good in quality ,1.0,0
La La Land - Bar & Kitchen,So now this has left me with no option but to write a review after coordinating with the manager Mr Rounaq Ali to get my 678 taxes INR back for the incorrect billing I made the payment for a total amount and when I got back home realised that the bar used my Zomato gold coupon but didn t apply to the final billing Utter disappointment They need to ensure that they don t do an incorrect billing as everyone has trust Sorry to say it failed here K,1.0,0
KFC,Their delivery sucks their customer service has dropped pathetic customer service very rude delivery guys who have no manners how to speak to women I will never order from KFC again Really if you continue to misbehave ill treat your customers you will pay for it you will be chucked out of India like Mac Donalds okay never threaten your customers you guys are disgusting Will never order from you again I hope you shut down because you do not respect your customers any more Pathetic Disgusted with KFC ,1.0,0
Delhi-39,very bad food,1.0,0
Hyderabad Chefs,Very bad Don t have rice quality Not cooked rice,1.0,0
Shah Ghouse Hotel & Restaurant,When you will order you will get other item surprising restaurant wheather you order chiken you will always get veg cheap cost item Better to don t order food my suggestion because I ordered more then twice got less cost cheap unordered item save money,1.0,0
Komatose - Holiday Inn Express & Suites,Worst experience ever They didn t serve food till 11 Pathetic music Starters were cold No one was there to serve drinks It was a group event we all were very disappointing,1.0,0
Faasos,Got Navratri Thali as a review meal and was highly disappointed in them First of all the meal reached 3 hours late than the promised time The items were literally swimming in oil The food was too oily and taste mediocre This thali needs a lot of improvement,2.0,0
Zing's Northeast Kitchen,Couldn t resist posting this review Has been visiting this place since the time it opened has been there multiple times Never before felt this urge of posting a review since the food always stood out and dominated the service But nothing changed over the time in terms of service rather it s turned worse over time There can t be an excuse of quality of food in exchange of service If food is the only yardstick they fail to beat that as well Dishes are pretty authentic but equally monotonous in taste As a customer I would rather not visit to wait for two ordered dishes for an hour Worse food that can be had sooner is always better than slightly better food with infinitely worse service ,2.0,0
Shree Santosh Dhaba Family Restaurant,Did a big mistake by ordering from this restaurant when I had so many options to choose Worst panner biryani I ever had If you have no food better to be hungry than to eat food from here ,1.0,0
La La Land - Bar & Kitchen,Well sometimes rating can be misleading We visited the restaurant first time checking its online rating but found it too be much worst than one can imagine The Beer we selected from menu was not available so we decided to go for bucket of Corona bucket Bucket beers are either served in ice bucket or at least bar tender ask customers to check it is chilled Well here the good bar tender bought all six beers holding in his hand and was about to open it when we checked its temp We were surprised to find it almost equal to room temp And the irritating part was when the waiter behaved as if its too normal to serve such beer We asked for the best food they have and in next 10 mins we had Dragon chicken served Eating it all I can say if it s ur best then your worst is not for humans Next we ordered crispy corn not to surprise us crispy part was completely missing and masala added on top of it was enough to burn ur taste bud All i can say if you know what a good food ambiance and hang out place Never ever visit this place ,1.0,0
Shah Ghouse Spl Shawarma,You ppl always miss the curd and raita and lemons on Biriyani order form this application please provide all the things along with food If you don t change this ppl definitely look your collapsing in soon ,1.0,0
Desi Bytes,very avg litti chokha was worse or stale paneer tikka was painted in orange color and everything was packed in plastic bags very inexperienced way of delivering overall not recomend ,2.0,0
Cream Stone,Taste was pathetic I didn t like it Roadside ice cream would be better than this ,1.0,0
Asian Meal Box,it is said medium but it looks like small only ,1.0,0
Squeeze @ The Lime,Order items are not delivered completely,1.0,0
Labonel,the cake i bought started smelling bad the very nxt day seriously u charge 2200 for a cake n dats da way u make it n not to forget the hair strand i get from it ,1.5,0
Club Rogue,Staff was very rude Confused the order and asked our group to leave Worst service staff I ve seen so far in Hyderabad STRICTLY DO NOT RECOMMEND ,1.0,0
Squeeze @ The Lime,Too much plastic for packing 30 of whole order were just plastic covers ,2.0,0
Al Saba Restaurant,Food quality is not good and the restaurant is also not clean at all Service is bad and they don t accept cards Paytm Food 1 5 Ambiance 0 5 Service 1 5 I don t recommend this place ,1.0,0
Kritunga Restaurant,Not at all satisfied with the food Order was for fried piece chicken biryani received normal chicken biryani with bones and quantity of food was also very less asked for solution wasn t provided poor service in online way,2.0,0
Asian Meal Box,Very bad service no less than tricksters should be sued for this just need opportunity for taking money evn after one minute of cancellation they are not refunding money,1.0,0
The Chocolate Room,Have been delivered a very bad version of this cult favourite dish of chocolate room Didn t give ice cream instead it was clearly whipped cream ,1.0,0
