Restaurant,Review,Rating,Label
Squeeze @ The Lime,Went for a lunch buffet on a Monday and the restaurant was not crowded Ambiance was very good Starters served were good especially corn and finger potato which was too crispy and yummy with the mayonnaise Pizza was average Main course included was Mushroom fried rice roti with paneer curry pasta noodles and they are all decent All in all for the price 299 tax this place gave us good food for the buds ,4.0,2
The Indi Grill,We happening here ever week for team lunch the best about the Indi grill is their grill starters We love their food and service Sahil ritam and ezaz are awesome thank you team Indi ,5.0,2
The Foodie Monster Kitchen,This place is very common to the corporate people who work in DLF and its premises for its reasonable price and food with perfect quantity and quality The only thing i would suggest everyone is do not opt takeaway homedelivery for waffles because when hot waffles are made they are immediately stored in plastic boxes due to which hot air is released by the waffles and condenses in the box itself thus it becomes very soft and disgusting to eat I have ordered Best of both worlds Reg Waffles pancakes scrambled eggs and cold coffee and Veg iron monster panneer biryani and coke pancakes were yummy along with maple sauce scrambled eggs were amazingly toasted without using much oil panneer biryani was just ok a bit more flavoured Cold coffee tasted like regular one Packing quality needs to be improved ,4.0,2
PourHouse7,It s good place to visit Pradhan was serving us He was polite and friendly Had a good time Like to visit again at night for checking out ,5.0,2
Shree Santosh Dhaba Family Restaurant,good,5.0,2
Paradise,Order drumsticks and chicken biryani Just awesome taste and good service 5 rating Good response from service boys and good serving Good seating,5.0,2
Triptify,I ordered the combo of aloo paratha and paneer paratha I really like the quality and quantity that they give in one serving along with the curd green chutney and pickle and a small butter It is really a wholesome and flavorful meal for a person If you are craving for some home style paratas this is a really good place ,4.0,2
Tempteys,The Oreo shake was a bit of a disappointment but the Brownie shake as always lived up to expectations ,4.0,2
Shah Ghouse Hotel & Restaurant,The place to have one of the best Biryani s in hyderabad Chicken and mutton biryani are both awesome The food is hygenic and well cooked Chicken 65 and chicken biryani are a must try Veg starters are also taste worthy and relished at time Cheers Rakshita Nath,4.0,2
Shah Ghouse Hotel & Restaurant,Food and taste is fabulous nothing there to complaint but the way they use containers for delivery need to improve Sometimes for curry orders packages are leaking out To be top all the facilities provided by restaurant should be in best quality ,4.0,2
Tiki Shack,Great place to hangout with friends Been here for a party Music was classy and ambience was more classy Just hit the place and get sloshed,5.0,2
Hunger Maggi Point,good delivery,5.0,2
Tempteys,Tempteys has never disappointed with its wide varities in milk shakes Love its ambience Tried Mr Cake Fruitti which was a big thumbs up One should definitely try out this will surely fall in love with this amazing milk shake Also tried Crunchy Orange that did not meet my expectation Crunchy Almond Feast is also a good one ,4.0,2
Barbeque Nation,Numerous options Grilled chicken and prawn all the kulfis in different flavors are tasty Pineapple jalebi was very different but okz in taste A perfect place to satisfy ur hunger with great food ambiance and service Great staff The service is very good You can ask them to serve the starters according to ur taste requirement spicy or mild Please do the advance booking as it have rush on all the days ,5.0,2
Mustang Terrace Lounge,MUSTANG TERRACE LOUNGE This restaurant and bar is perfect for casual dine in on weekdays and best for Friday night they have a cozy interior seating and the outside seating gives the best view of the city the menu includes the best snacks to have with drinks such as Malai kebabs Tawa machhi Dahi kebabs stuffed mushroom and many more The restaurant has a wide variety of Mexican and Italian cuisine dishes such as enchiladas quesadillas burgers pizzas and pastas This is a must visit rooftop place in Hyderabad ,4.0,2
Over The Moon Brew Company,Great ambience met an excellent man Sarbeshwar Super cool guy and great service Food and music is excellent Basil chicken tikka is a must try ,5.0,2
Hyderabad Chefs,good,5.0,2
The Glass Onion,Beautiful place It is a best place to go If your looking for a guite evening An open golf course on view The food is amazing Soothing music Lovely ambience and highly recommend for continental and tandoori cuisine Service was slow for us But it is cool n clam place ,5.0,2
Biryanis And More,Biryani is soo tasty and we loved ur service maintenance so nice I satisfied my self with u and ur tasty Biryani Definitely I will come again and again to njy ur service,5.0,2
Absolute Sizzlers,Its nice place to dine for team lunch Great service Great food Nice ambiance we want to visit again we loved service thanks team absolute,5.0,2
Barbeque Nation,Unlimited BBQ food with delicious desserts Ambiance Barbeque Nation is located near Wipro Lake exactly beside Deli 9 Bistro This outlet of Barbeque Nation is quite congested As it is situated at the Ground floor indoor sitting includes well maintained sitting arrangement with large tables of capacity upto 8 10 people per table They play silent English songs in the background Food As we have arrived before 7pm we got the privilege of the early bird complimentary mocktails They served veg kebab and american corn before starting the barbeque As we were six members they brought 2 barbeques In the barbeque they served all types of non vegetarian and vegetarian food including prawns chicken fish mutton paneer potatoes corns We had lots of prawns and fish in the starter and had for at least 2 hours After that we moved towards the soup they have only one non veg and one veg soup We requested for hot and sour soup so they prepared for us In main course they served veg as well as non veg curries Chinese and biryani Finally they had a large variety of desserts in their menu including kulfis ice creams Gulab Jamun pastries firni and brownies Service Service was very quick and the staff was very good Chef himself came to our table to take the feedback ,4.0,2
La La Land - Bar & Kitchen,A small cozy place with a dim ambience and loud like very loud music perfect for a bunch friends to hangout Drinks and food were good but I felt it was a bit pricey Overall we had a good time Oh Did I mention they ve a dance floor too ,4.0,2
Aromas@11SIX,good delivery,5.0,2
KS Bakers,I loved everything here Tasted pastries I loved them specially premium butterscotch pastry one of KS person recommended me I liked it very much ,5.0,2
Mathura Vilas,Exceeded expectations to frame it simply Simply loved the pure vegetarian food after a long time even being a Non vegetarian All the starters we ordered are awesome Main course curries are good but not as good as starters Ambience is good serving has to be bit fast ,4.0,2
Hyderabad Chefs,awesome taste but prawns pieces are less,4.0,2
Biryanis And More, ,5.0,2
Feast - Sheraton Hyderabad Hotel,Came here for a dinner with family and the food was great Purmita was very friendly with the kids and asked for food options and got us a pizza from the live counter The section is will managed during the dinner time which was managed by hema Overall a great experience if you want to go out with family for a relaxing dinner treat ,5.0,2
Eat India Company,Went for my friend bday party with team staff are very helpful And service was really great food is delicious specially Singapore prawn only problem is Ac is not working rest everything went superb thank you Mr Srikanth for providing us excellent service And food diffentitly for sure eat India company will be my best restaurants for Hangout with friends diffinitly We will be visiting sooner Thanks to all the eat India team ,5.0,2
Pot Pourri,Server sushanth is very friendly and polite He suggests each and everything with patience His service is also very good Finally made this restaurant my regular place,5.0,2
The Glass Onion,The ambience is outstanding we went in for dinner on a Saturday night Book the table in advance We ordered non veg platter and a Pizza with wines and beers Food was good not great but the ambience is superb serene backdrop and good music is all you need ,5.0,2
Pista House,Delicious food i had good experience with this food i liked a lot next time i will definitely choos swagath grand but expected dessert along with veg biryani ,5.0,2
Hunger Maggi Point,good it is delivered on time,5.0,2
The Old Madras Baking Company,Loved the bakery they have bunch of bakery items to try along with pasta pizza sandwiches and soups Ambience and delivery time is just apt for an evening hangout place Things to try for sure Carrot cake Victoria cake bagel and cream cheese,4.0,2
The Old Madras Baking Company,The Old Madras Baking Company How posh does it sound and what a spectacular ambience This place is a must try for breakfast lovers They have really amazing bread rolls and bakery items available for purchase I ve tried their garlic bread the English bread their croissants Chocolate muffins custard and chocolate danish brownies all worth it Over breakfast I tried the triple cheese sandwich found it quite average the white sauce pasta was delicious though I ve also tried the mushroom sandwich with other veggies super amazing Although the price point is probably a little on the higher side it s worth a try ,4.0,2
Udipi's Upahar,Requested to replace Sambar with Chutney but that was not done ,4.0,2
The Fisherman's Wharf,The ambiance and setup basically the theme is just superb Very cordial staff and efficient too The highlight is of course the food Try the fried squid and butter garlic prawns A bit expensive but worth it Music is a little over the top and unpleasant at times ,4.0,2
The Fisherman's Wharf,This place makes you feel like you are at the shore of a beautiful beach in goa sipping on your favourite drink and just taking the whole feeling Designed to make you feel like your on vacation it ticks all the right boxes for a foodie like me Different sections of the restaurants are named after various places in goa making it a perfect place to feel like you are on a vacation We had the potato rechado which was spicy and very flavourful Mushroom tonak and Mix veg foogath with vegetable pulao was our main course which we enjoyed as well It is the place if u want to try goan cuisine ,5.0,2
PourHouse7,Awesome place The waiters have good behaviour and the DJ is awesome The food here is also good We had ordered Chicken kebab which was properly cooked and yet soft ,4.0,2
eat.fit,Eat fit is is the next level service witch can offer you the basic and simple food with all required proteins calories and energy And their packing is awesome ,5.0,2
B-Dubs,That was a really awesome experience visiting to bdubs and the wings are really awesome prabhu and Praveen took really good care of us and the gaming was too good really willing to visit again,5.0,2
Pakwaan Grand,This is kinda good for biryani and is exactly located beside the shah ghouse I heard about this place before many times so I wanted to try it so I went This place has both ac and non AC section Coming to biryani it was finely cooked but the tandoori chicken was burnt more that it needed Finally good place to visit easily located and comes to food It was worth the hype,4.0,2
Feast - Sheraton Hyderabad Hotel,We had gone for our anniversary dinner Dharma the attendant for very polite and courteous Food was also very good Enjoyed our time there thanks to Dharma,5.0,2
Absolute Sizzlers,Sizzlers are really good here but one must have knowledge what they want exactly along with sizzler otherwiSe it s hard to fiNish it of and also need to update the orDer with pice level for spice lovers,4.0,2
Over The Moon Brew Company,If you ever want to enjoy amazing food and desserts and drinks then please I request you please visit this place Great ambiance and music We had ordered Mexican Pizza Chicken platter seafood platter Chicken Penne pasta In desserts Cheesecake and Brownie and Ice cream was the best ,5.0,2
American Wild Wings,Best American Restaurant in Hyderabad Justified name Wild in quantity and American standard Ambience Great place to hangout with teams and family ,5.0,2
Udipi's Upahar,I ordered so many times here food was really good and the sambar is good to have but chutney is not at all good and set dosa poori with kurma good to have all they have to do is to improve CHUTNEY PACKING 5 5,4.0,2
Delhi-39,paneer quantity is very less compare to other restaurants,4.0,2
The Indi Grill,Overall food was good Anytime better than BBQ Nation Salad options could have been improved Menu was loaded with regional foods like Gatte ki Sabji of Rajasthan Bengali Fish Curt Etc However Gatte ki Sabji not at all upto the mark,4.0,2
Hyper Local,The ambinece is Greet for a weekends night party the outdoor siating the Food is Greet verry fraindly staf thanks Roshan coming agen and agen,5.0,2
Squeeze @ The Lime,Sizzlers are smoking hot here Staff are really friendly help u in choosing a dish when in turmoil Although it took time for them to serve the dish was worth the wait ,5.0,2
"3B's - Buddies, Bar & Barbecue",Friendly and responsive well behaved Govind has made ur meal very friendly this kind of behavior is always encouraged Nice ambience nice food nice starters stone ice cream is too nice ,5.0,2
GD's, DoYouKnow A burger is the short name but in fact called as Hamburger and if you lay down all the hamburgers eaten my Americans only in a year it circles earth 32 times So why Burger topic now Because of my recent visit to GD s opp DLF that offers quick bites like sandwiches hot dog grilled chicken starters most importantly their famous mouthful sized burgers Galaxy Burger no wonder a fast selling pick for its grilled buns crammed with two layered cheesy juicy meat that over salivates your palate Grilling bun might need a little tweak to avoid chewiness or I am that one unlucky chap Followed by brilliant CometTail hot dog with freshness in every bite and decent smokey AtomicWings with a sweet tarty BBD sauce finish but a little over grilled Though many of them choose this place for their speciality Meat burgers they do have good coverage for Egg Veg etarians and heard AntiMatter burger is a worthy try Overall paid 480INR Value for money yet filling one soul comfortably are the key reasons which can potentially bring you again burger sandwich hotdog wings DLF whenatgachibowli wheninhyderbad Hyderabad shotoniphone food foodie LoveFoodHateWastage EatResponsible Foodenthusiast foodblogger foodphotography hyderabadfoodblogger annadathasukhibhava palatepassion clickeatxploreyo wordpress com,4.0,2
SKYHY,Chilled out place for office party Went at 6pm and place was super quiet If you have good company and want to have relaxed drinking experience go before 7 pm Zomato Gold works well you can pay using dineout app Staff is super cool ,5.0,2
T Grill,Since this place is close to my office and they serve South Indian delicacies I ve decided to go there with my team This place has got that simple dhaba vibe and the food they serve is lip smacking If you are non vegetarian this place is a must try Also if you are here do eat their Kadhu ka kheer in desserts Ever since I ve tried that I ensure that I order this every time I go there and recommend this to friends and this one has never let us down ,5.0,2
Momos Delight,delivery was great,4.0,2
Jonathan's Kitchen - Holiday Inn Express & Suites,Had a great lunch The buffet spread was good Very good for office parties Desserts were good too Rice varieties were too less Ambiance is nice ,4.0,2
Urban Asia - Kitchen & Bar,They now have Kings beer from Goa That gives them the highest star already Ok now for a detailed review 1 We had to ask twice for an order we were waiting on but will discount since it was weekend which usually is buffet n we went ala carte 2 Asked for lemon slice for water and came promptly 3 Beer was served at good temp 4 Anda Bandi fried egg rice was really good 5 Coupled with urban asia spcl chicken it was awesome 6 N then we ordered spare pork ribs Ohh the fat was delicious on it n meat just falling of the bones Overall verdict with Zomato gold it s A steal Even without it worth every buck,4.0,2
Banana Leaf Multicuisine Restaurant,Went for a lunch buffet a little while ago and found the place to be moderate Food here was good only hoping for better choices I understand that providing buffet becomes a tedious task when everything has to be covered up under one roof so not complaining much Ambience wise the place doesn t have much to offer But the staff was the sweetest There was this lady whose name I can t recall but she when I asked if I can get some gulab jamuns even after it was over she made them especially for me and delivered on table That gesture made me like the restaurant better PS They don t really serve on banana leaves ,4.0,2
NorFest - The Dhaba,Amazing food Probably the best North Indian food in Hyderabad Loved the rajma chawal kadi chawala and their Dal makhani Saviour for North Indians,5.0,2
Momos Delight,One best momo stop in town From don t know how long i have been looking for places that serve good momos in hyderabad and found none Recently ordered from this place and turned out they are just the best momos you can have I ordered chicken steam momo and kurkure paneer momo and both of them were very delicious Home delivery was very quick ,5.0,2
Cafe Eclat,Really amazing place Has vibrant and nice decor Menu is really distinct and elaborate Great people for people with sweet tooth for desserts Even coffee is really great Pasta is delectable too,5.0,2
Amul,Timely Delivery,5.0,2
Hyderabad Chefs,excellent,5.0,2
Over The Moon Brew Company,A nice place to hangout with friends and have drinks Must try the brewed beer I tried the OTM ledger which was pretty good Food wise pizza was pretty good We ordered the mexican pizza Along with crispy lotus stem and water chestnuts Deducting one star for poor service and lack of staffs which resulted in delay in services ,4.0,2
AB's - Absolute Barbecues,Excellent service by nandan and rahmat and ripan and feeling happy for and the management food awesome and expect to i will come again soon abs service boy are fantastic,5.0,2
Frio Bistro,Good place to visit and the ambiance was awesome Best place to hangout with friends Food was yummy the starters were good The overall experience was awesome ,4.0,2
Feast - Sheraton Hyderabad Hotel,An amazing place to visit whenever you need a quick stay in Hyderabad A must try place And the food is amazing Really delighted to be here Do visit for sure And I ll surely visit here the next time i come here Ratul has provided me with the best service here and other working staff has been very concerned towards the food queries and everything Do visit whenever you need to taste some amazing food ,5.0,2
Diners Pavilion,A classy restaurant in Gachibowli area that serves super awesome Hyderabadi food at a very reasonal price The waiters are polite and accommodate any special request you have as to how the food has to prepared,5.0,2
Yum Yum Tree - The Arabian Food Court,A gem and must try Hyderabad restaurant The ambiance to sit relaxed and enjoy with friends plus the unmatched pleasure of getting high on briyani I tried the mutton mandi and it was extremely tender and flavourful ,5.0,2
La La Land - Bar & Kitchen,Ambience Very relaxing seething and decoration are good Went with friends for buffet We have been welcome very gracefully The restaurant wasn t crowd We got comfortable seating Soup and snack has been served on the table For main course we have helped ourself Service was very good and impressive Now coming to food all the dishes are awesome Good taste and rich quality Total value for money Recommended,5.0,2
AB's - Absolute Barbecues,Nandan and varun did excellent and awesome service please vosit and request this service keep up the very good and treat everyone as good as possiible like this,5.0,2
Zega - Sheraton Hyderabad Hotel,Went to zega for our first wedding anniversary thoroughly loved it The staff is super friendly and the food and drinks were amazing Special shoutout to the cocktails tasty as hell Definitely going back here again ,5.0,2
The Foodie Monster Kitchen,Had a great experience Good place on wekend If you want to enjoy some awesome food TFMK is the name Ambience of the place makes it a perfect choice to visit with family ,5.0,2
Flechazo,Pleasant experience good food and excellent service Courteous staff Jayanta and Kusal hasibul Gggggggggggggggggggggggggggggggggggggggggg,5.0,2
Hyderabadi Daawat,Two items on the menu really stand out and you can visit this place just to try these no matter how far you stay One is the Yakhni Shorba loved it The other is Sikandari Raan which is a lamb leg made on coals The meat is to put it like the great food connoisseur Charles Boyle succulent and flavourful Really gives work to all your five senses ,5.0,2
Shah Ghouse Hotel & Restaurant,No onions for any biriyani full fake delivery Don t order and believe them they are delivering false biryani and fake identity of original ,4.0,2
The Old Madras Baking Company,I didn t give a 5 because I felt everything is a bit costly here But the bagel and cream cheese is a must try it s delicious Bagel costed 50 bucks plus cream another 50 ,4.0,2
Absolute Sizzlers,Thanks thanks thanks ones again thank you for your such a hospitality it s great place to dine Food was delicious even service also wow We want to visit again Highly recommend ,5.0,2
The Indi Grill,Great food Awesome ambience Excellent service by Raza and Subhendu Wide range of options in starters and desserts Reasonable pricing Must visit ,5.0,2
T Grill,A randomly sudden decision took me and a couple of my colleagues to this place on a weekday lunch we were unsure of our choice when we saw a few people sitting under the open huts and dining in the heat wave But the moment I opened what seemed like a kitchen door I was thrown aback to see 100s of people belting some South Indian meat Man this place is an oasis in the Puppalguda desert We being mutton lovers ordered a nalli starter and charcoal mutton chops looking at the crowd we were mentally prepared to go back to office in the evening post chai break but the waiter promptly brought the food in less than 10 minutes with a scalpel like tool with which we were to operate the nalli Our eyes shone The nalli did not disappoint us we then dug into the chops all my hours spent in drooling at pork ribs on YouTube were redeemed this mutton chops did the deed the meat wasn t the slimy fatty kind melting off the bones but was the perfectly grilled meat willing to separate from the ribs at our mildest effort we were already dreaming of another plate but decided against it in the best interests of our bellies then came the main course rotis mamasam pachadi and chicken biriyani first bite of the mamasam pachadi threw our chairs back by 5 feet we decided to ask the waiter to pack the biriyani and order another round of rotis to honour the pachadi for a person who consciously keeps away from gongura chutneys this one which clearly had gongura was just perfectly sour a bit more sour and I wouldn t have cared to write this review the meat was invisible we had to spot a narrow bone in the pachadi to even know there was mutton it was just mystically Omni present in the meat I guess this is what you would call divine food amen ,5.0,2
Khaan Saab,Very nice ambience superb food Perfect place to spend ur weekend for dining Tapan served us food He s a very nice person and perfect in his service ,5.0,2
Mazzo - Marriott Executive Apartments,Such a special night to remember when we decided to dine in for a midnight dinner at the beautiful poolside restaurant at Marriott Hotels We had made the night special and Marriott in turn surprised us with their lip smacking dishes too We had our hands on few cocktails namely Eye of the tiger and Bull frog which kept the mood flowing for the night The Chicken and Thyme pasta that night was absolutely delicious as the cheese has melted really well as could really enjoy the real taste Hands on this was the best compared to any pasta I tried in restaurants at Hyderabad Absolutely wonderful Wok tossed Hakka noodles too surprised as it lived upto the name of why it s called a Hakka It purely means an explosion of different flavours in a noodles and it really was At above 400 both dishes really is worth the money further considering the hospitality and the ambience of the hotel Food 5 5 Ambience 5 5 Service 3 5 Value for money 4 5,5.0,2
Hitech Bawarchi Food Zone,awesome,5.0,2
Sardarji's Chaats & More,missing cutlery,4.0,2
Hunger Maggi Point,Perfect for tackling hunger Several varieties of maggi are available Good in taste and pocket friendly Not a fan of spicy food so wish a little less spice is given in them ,4.0,2
Shah Ghouse Hotel & Restaurant,Loved the chicken biryani totally Mild spices well cooked rice 4 big chicken pieces But somehow got disappointed by the butter Naan and chicken Masala Anyways heaven for Biryani lovers ,4.0,2
