Restaurant,Review,Rating,Label
Pot Pourri,Went here for a team lunch party a while back and I swear to God the food was pathetic The starters they server were cold and even after calling out the waiter multiple times there wasn t a positive response When we called the manager there was a redo of the starter which was hot now but not tasty The ambience is good though If only the food and service were upped then the place could deserve better rating All we ate that day was curd rice the entire team I wish you guys could improve and we would try here again ,1.0,0
Mohammedia Shawarma,Please be advised of the tasteless crap load sold as shawarma Filled with vegetable and nothing but tons of vegetables to make sure you won t complain Perfect for one on diet or a vegetarian as they don t use much chicken Its just roti filled with cucumber and tomato kudos to the chef ,1.0,0
Desi Bytes,Roti delivered was very bad and was smelly half cooked,2.0,0
KS Bakers,I ate butter chicken burger paneer tikka roll The burger was disgusting The patty had a weird cloying sweet taste and the mayo made it worse The paneer tikka roll was nice and crispy on the outside but the paneer was very dry Almost like rubber ,2.0,0
The Tilt Bar Republic,If you have not tasted sauce go to Tilt Went yesterday beer is ok Cilantra fish tastes only of sauce Chilli Lamb tastes only of sauce Chilli egg tastes only of sauce Mutton kebab doesn t taste like anything Sad to say the most overpriced and shittiest food I have ever tasted in Hyderabad One star for the beer and masala peanuts On top of that they tried to scam us by charging a whopping service charge ,1.0,0
Urban Asia - Kitchen & Bar,I went to Urban Asia on a date and we had planned to have sushi Sushi was not available at all We were heartbroken Sorry Sir became the theme that night Date went dull ,2.0,0
Desi Bytes,portion size is very less and the taste don t even ask totally a waste of money ,1.0,0
Chinese Pavilion,I have been to this place on a sunday with my friends thinking I can have a good meal and spend time with friends but the moment I arrived there it was around 2 15pm and the manager there started nagging saying that the kitchen is going to close in next 10 minutes can you please place the order This continued even after we placed the main course around 2 30 pm too The food tasted good but the nagging was annoying ,1.0,0
Amul,Missing spoons ,1.0,0
Dunkin' Donuts,I been to this place on a Saturday morning to have a I was really disappointed with the service in the first place the air conditioning was not working I still compromised to have the donuts after having the donuts the staff was not able to give me the bill saying that billing machine is not working I had to pay the parking fee for my car since I was not having the bill I had a bad experience,1.0,0
Squeeze @ The Lime,So was here like 10 mins back the place is kinda okayish but considering that price range it becomes even more undesirable dessert was probably the best part of the whole course everything else was mediocre at best The Atmosphere is lack luster so even that doesn t help So yeah not the most exciting places to visit,1.0,0
SKYHY,Very bad place to hang on the staff is very arrogant and short tempered They don t allow entry to stags on the dance floor also and despite of so high prices haven t given any discount even not corporate discount too ,1.0,0
Royal Spicy Restaurant,it s not like what I order,1.0,0
The Foodie Monster Kitchen,Ordered for brownie which was completely dry and was not fresh at all Choco banana Waffle was okay not so good They send the food in big box which looks like will have good quantity But will get a small piece and that is too tasteless,1.0,0
Frio Bistro,Good food but not very friendly customer service The servers were way unfriendly Overall average experience Would request management to improve the quality of staff serving the food Their attitude needs to improve ,2.0,0
Diners Pavilion,One of my worst dining experience ever The staff took one and half hour to serve the main course and another half an hour to provide cutlery Way to ruin my bday dinner with my parents with me actually leaving the restaurant empty stomach ,1.0,0
Banana Leaf Multicuisine Restaurant,food delivered was of very bad quality,1.0,0
Over The Moon Brew Company,The customer service was very bad We ordered lobster and they served us prawns with lobster shells After a lot of argument chef accepted that yes we add prawns But as per me there was no lo aster meat also everyone from waiter to manager were telling different things ,1.0,0
Owm Nom Nom,food is cool,2.0,0
Urban Asia - Kitchen & Bar,Terrible experience The place was crowded and noisy The food had an odd smell to it it almost tasted like they were using expired ingredients Wouldn t recommend to anyone ,1.0,0
Beyond Flavours,I have been at this place for dinner a few days back The ambience was good The restaurant was almost half occupied We immediately got a table But then waited for 10 mins to get water and menu that too after a few reminders We ordered a few starters main course items and mock drinks Only the starters could be served in 30 mins There was no sign of mock drinks We noticed similar service issues on other tables Noticed guests literally shouting on the staff The food was just average Dishes were not prepared well at least when compared to 4 1 rating on Zomato We finally decided to just have starters and hop onto another restaurant for rest of the meal ,2.0,0
Hotel Zara Hi-Fi,Food delivery was taken 1 hr 10 mints and food is very high spicy unable to eat so we have thrown in dustbin Worst experience with this restaurant ,1.0,0
Being Hungry,Food color is more Worst food which I ate in Hyderabad Unable to eat Paneer biriyani is full of food color Mushroom 65 is also full of food color ,1.0,0
Tiki Shack,Hi Though I love the place The service offered was pathetic to say the least the restaurant didn t offer the Gold privilege saying they don t offer it on weekends Later during exit when I checked with the manager he said there is no such thing but we were already billed til then Our serving staff also asked us to pay via Google pay without bill So please beware of these things when you are you are at the restaurant ,1.0,0
Amul,very late delivery,1.0,0
Dunkin' Donuts,The donuts were not fresh it was pathetic in taste worst donuts ever eaten I ordered three donuts in which two was completely uneatable and the third one was also stale and had a bad smell The smell was like a chemical added ,1.0,0
Banana Leaf Multicuisine Restaurant,not good chicken pieces are fully roasted Disappointed Not a good taste ,1.0,0
Shanghai Chef 2,Stale food and indigestible noodles Please don t visit here if you don t want to fall sick The chicken was dry and uncooked the noodles was sticky and under cooked Felt the items were reheated as it was served way quicker than expected ,1.0,0
Dine O China,I went to this place as a part of our Sunday dinner I already heard so much about this place from my friend The taste of the food is no doubt good but I found stone in the soup I ordered Thankfully it doesn t go inside my stomach Unfortunately no body bothers to say sorry they just gave 73 discount to us The waiter was also very cunning first when we complained about the stone he said he will discount but later he came with the bill without discount So we again asked him to give some discount then only he came up with new bill ,2.0,0
Shree Santosh Dhaba Family Restaurant,naan is not gud ,2.0,0
Pakwaan Grand,its not biryani its plain rice mixed with some masala I have ordered from this restaurant earlier but this time it is horrible ,1.0,0
Green Bawarchi Restaurant,Worst food,1.0,0
The Chocolate Room,Not as regular No choco Sticks are there not satisfied Lose of money,1.0,0
Amul,Quantity was not same as always and there was no dry ice in packaging,2.0,0
Labonel,love the blueberry cheesecake takes you to heaven complete foodgasm achieved i think they should keep pastries too cupcakes and cookies are a must try min order is 10pcs thats the only setback for people craving for a sweet tooth overall superbb ,4.5,0
T Grill,Horrible service Tasteless food poor service worst ambience Too costly Will never visit again to this restaurant Veg and Non veg food both are worst,1.0,0
Marsala Food Company,Customers won t really care about your ambience or service if your food quality is below par I ordered Chicken dum biryani from here relying on their ratings but the very first experience itself was really bad The chicken tasted horrible and was stale I had to throw away the biryani You guys should check the food before delivering it to the customers as delivery of this kind of food does not only affect the ratings but also can cause serious health issues I value food which is worth the money spent and I feel betrayed here I contacted zomato regarding the issue and they just assured me that this won t happen again and conveyed that they have shared feedback with the restaurant They should have issued a proper refund here I did not expect this kind of service and I really don t look forward to trying anything from this place in future ,1.0,0
T Grill,Great ambience and hut style Ragi mudda combo was so tasty and fish is awesome Must go with family ,3.5,0
La La Land - Bar & Kitchen,We went for lunch buffet Very limited options for starter 3 non veg 2 chicken and 1 fish and 3 veg 2 potato and 1 paneer they were serving the starter cold The tawa fish was over spicy and they didn t prepare a lesser spicy version of that even after our request Only chicken wings was good Main course was kind of good Egg fried rice and veg noodles were good Chicken biriyani was stale Dessert was good Chocolate cake gulaab jamoon and Ice cream were good Semiya kheer was horrible ,2.0,0
Shree Santosh Dhaba Family Restaurant,Food was not that bad but it took too much time to prepare the order by restaurant I avoid this restaurant in future ,1.0,0
T Grill,Third class attitude rude staff pathetic food is what defines this place Good luck if you happen to stall here by mistake A basic order takes more than half hour Food lacks taste and staffs think they are over qualified for the job they are doing ,1.0,0
Olive Garden,Visited this place for lunch buffet after seeing a lot of good reviews But it was a total disappointment Food was not at all good There were many items but none of them was good On top of it attitude of owner manager was icing on cake Not sure how they got these many positive reviews Wish there was rating below 1 Total disappointment ,1.0,0
Karachi Cafe,Ordered pasta and taste was not at all good,1.0,0
Asian Meal Box,I ordered Veg Manchow soup Chili Gobi Noodles with panner 65 Manchow soup is Gud Chili Gobi Is worst atleast it s not boiled fully and tasteless Noodles was OK Over all I am very disappointed Not suggesting please don t waste your money,1.0,0
Al Saba Restaurant,Great quantity and good platting for my starters and other chicken dishes also good quality in tandoori they have to improve on the server and service too,3.5,0
Hotel Zara Hi-Fi,If anyone wants to order from this restaurant think before you order the food they will give the biryani rice from Chicken Biryani even if you order for a Veg Biryani and the butter naan will be like a chewing gum u have to chew it for a long time to swallow it ,1.0,0
Hotel Zara Hi-Fi,Very poor food it wasn t fresh Too much oily chapati you can t even chew so much refined flour I ordered chicken but it was not fresh Disappointed ,1.0,0
Aromas@11SIX,I ordered Kadai Veg and Methi malai paratha Both had a lot of soil particles and we couldn t eat either of them On my previous experiences I really appreciated the food and highly rated the restaurant for the same dishes that disappointed me this time We ended up ordering from somewhere else since the restaurant didn t act on my prompt complaint ,1.0,0
Sardarji's Chaats & More,If you dont want to deliver the food then dont accept the orders in the first place and the cancellation call from zomato comes when you expect your food Be careful while accepting the orders or at least dont make the hungry people wait even to know about the cancellations Giving 1 star bcoz cant rate below that,1.0,0
Pakwaan Grand,Wost Biryani I ever had from here today I know it was late when I ordered for Paneer Biryani but the delivery I received was absolutely unexpectable It was a plain rice with Butter Paneer Masala at the end seriously I was shocked when I opened the package Last time I ordered Veg Biryani which was also just accpetable So from my past experience food from this place is totally non recommendable specially for vegiterians Pakwaan Grand team guys plzzz,1.0,0
Zing's Northeast Kitchen,I would give a negative star if possible for their hygiene and service We ordered our food at 9 30PM and after an hour s wait they come and say that what we ordered from the menu isn t available We had to order something else and wait for another 30mins and then to my surprise I found HAIR in the food So in short it a was a terrible experience ,1.0,0
Absolute Sizzlers,Service was pathetic Ordered a sizzler with lamb was told no lamb Ordered another sizzle with Noodles It took 15 mins to serve that one Also served it with rice instead and when I asked to change they gave me a noodle differently and that too since they were irritated with lots of chilli sauce I sweated through first 5 mins and then just left the sizzler as such No apologies nothing from there side When asked for manager told me he is not here Prakash was not helpful or apologetic he just denied that he never served it Benjamin still was apologetic about the whole goofup ,2.0,0
Hotel Zara Hi-Fi,The chilli chicken was so bad when i ordered The quantity was even less Not worth the money at all Noodles were tasteless but quantity was fine Overall not a good experience ,2.0,0
10 Downing Street,I have always loved the TDS chain Been to Kolkata Bhopal and Hyderabad But hyderabad has been the worst experience ever Very bad service We had to wait for long hours for the food to be served No one was bothered even about the bill ,2.0,0
Shanghai Chef 2,I had high expectations of this restaurant but was dissapointed I sometimes ponder to visit them again because as per user reviews they are good The seating is well the air conditioning is not Its either chilly or completely stopped You cant help it The servers are less and even being a small place you have to shout to catch their attention The food Oh God I dont know what happened with the chef that day but he had put spinach in all of my dishes and that too in huge quantities They were wreaking havoc on the plate and we had to leave a dish totally for that matter So many wrongs bounds me to visit them once again to see whether they are like this all the time or was I unfortunate to visit them on their bad day They also need a experienced manager Ambience 2 Food 2 Service 0 Value for money 1,1.0,0
Urban Asia - Kitchen & Bar,Absolutely horrendous service We avail Zomato gold services and we had clearly mentioned that we wanted to avail this service before entering the restaurant We placed our order at 3 p m and they ask us to show the Zomato Gold ID right after 3 p m restaurant closes at 3 p m and kitchen at 3 15 each restaurant seems to have a different policy and we customers should know beforehand what the policy is We had made it crystal clear that we were Zomato Gold holders and they said we could show the ID later How is it fair that the staff asks us for the ID after the restaurant has closed and when we could not unlock it We are first time users of Zomato Gold We had to walk out Horrible service Stay away from this place if you do not want to be treated poorly by the manager and the staff Thank you for ruining a special day Why do such places have Zomato Gold partnership Probably what they re good at is cheating customers ,1.0,0
Driven Cafe,ordered tea but received milk,1.0,0
eat.fit,AVOID This place is a scam If there is even a place I cannot find the physical restaurant on google maps by the provided address Anyway I ordered a healthy chicken breast dish They claim to offer healthy dishes and organic ingredients which look fantastic on the photos Then you get regular oily fatty suspiciously saucy Indian takeaway full of sugar and complex carbohydrates probably from some nearby restaurant or street food stand The only healthy thing about it was the size of the portion No wonder it is low on calories you can literally finish the whole plate in 4 bites There were exactly 2 small chunks of chicken on it maybe 25gr total submerged in some ketchup based sweet sauce I doubt it was even grilled It looked and tasted more like it was fried although with the disgusting oily sauce sugar coating it all who knows The picture of the plate showed a full bowl of grilled chicken breast only plus the sides on other plates I should have taken a photo to show on this review and compare with the one on the menu but I was too hungry and mad to think about anything but eating the disappointing food At least it wasn t too expensive but definitely not healthy not cheap and not good quality food ,1.0,0
T Grill,It amazes me to see the current rating of the restaurant on Zomato The taste of food service and unhygienic food ambience describes a holistic and gloomy conditions of the restaurant The food quality has degraded with time I would never visit it again ,1.0,0
Jonathan's Kitchen - Holiday Inn Express & Suites,worst service I ever experienced If we order an item no one take responsibility to bring it They will stay at the corner and chit chat each other There was a lady I said ur servicing was very worst and smiled in sarcastic way and went off They will replace items after 20min We have to wait for that item Even bowls for sweets they will bring after half an hour that too not more than 5 At last I feed up with the services and had thought to have sweet and I find an Cockroache in the bowl I called the lady and waiter they did not responded Then I went to kitchen and called a person ranjith he took the bowl and went inside the kitchen and came back and said sorry and offered 5 Ice creams We were around 30 people And he saying to come in the evng or next day I don t know what they think about the customers Basically it looks like decent and star hotel but the people and the service just like irani cafe At least in cafe if we order they will get it fast or else inform us if it late I heard lot about Jonathan kitchen food is absolutely good But the people their behaviour and neatness was very very bad Kindly find the attachment Thank you and I never visit u ,2.0,0
The Glass Onion,The service is shit the waiter asked us not avail Zomato gold at the beginning of the order but to avail at the bill time But gold was not available but to compensate no discount was given disappointing experience,1.0,0
Shree Santosh Dhaba Family Restaurant,not good ,1.0,0
Shah Ghouse Hotel & Restaurant,I have ordered multiple times from this restaurant and I have never been so upset Of course I have recieved wrong orders from this place once or twice before which I ignored and not reported thinking these might be human errors but its beyond those now Orders can t go wrong so many times when you have such a full fledged food business across the city Yet another incident today where my order was wrong You can check with my name what I ordered and find the attached picture of what you sent in my very recent order which was on 7th May 19 Hope you people learn from your mistakes and yes I wouls also like to bring it to notice that the zomato support is no good either They deny support right on your face which is unprofessional and unethical both at the same time Guess Zomato needs to upgrade their standards and teach their support reps about what customer service is about and how to do it right ,1.0,0
Delhi-39,Small restaurant Restaurant in Underground Not clear visible from road Food not Upto mark Service too slow Waited 45mints for table order Counter staff very busy to listening music on headphones staff can t manage online and local restaurant orders ,1.0,0
Over The Moon Brew Company,Firstly the seeating space is less and the music for garden seating is really bad Some of the items in food menu were good but my mood was dampened by the extremely bad service This not a place to spend more time or chill ,2.0,0
Yum Yum Tree - The Arabian Food Court,the chicken was raw ,1.0,0
Tiki Shack,Ambience and location is nice But nice to hangouts only in group and a girl is mandatory to be in group Else entry will be denied Thumbs down for stag Starters are good but main course is really horrible Very small portion of drinks specially when they see you are busy in chatting or talking The staff is polite but you have to chase them multiple times for taking orders You can have opt for this only when all other nearby places are full The complete street is full of restaurants and can be given priority You might see lot of positive feedbacks but most of them are done just to get a free ice cream Yes they offer free ice cream if you write good reviews for them Luckily I don t like vanilla flavour so will write what I felt ,2.0,0
Deli 9 Bistro,Despite having a prior booking They made us sit in the last where the AC wasn t sufficient The management was too ignorant Said the same thing multiple times all to deaf ears There s nothing that was too good about it The food was below average and too pricy for the portion and taste they serve Won t recommend ,1.0,0
Barbeque Nation,Had a worst experience today at BarbQ Nation gachhibowli hyderabad Taste is not as good as remaining branches Non veg items seem to be frozen few days back then coocked feels like a was while eating,1.0,0
KS Bakers,Pretty good here all varieties puffs and all I tried chicken 65 it s nice not very spicy but decent we would roam daily here really crowdy in evening anyway must try ,4.5,0
Biryanis And More,Visited this place today Food is no doubt good but the service is awful We had to wait more than 30 minutes for the food to be served that too when we asked then they served The staff was rude as well Had to ask for every little thing Even the basic services were very bad Would suggest the owner to improve the staff and services ,2.0,0
Domino's Pizza,2vegs instead of 2veg 2 nonveg,1.0,0
Shah Ghouse Hotel & Restaurant,Worst food received low quality rice was used egg fried rice was almost spoiler unable to eat Worst experience ever does not recommend ,1.0,0
Kritunga Restaurant,Not upto the mark,1.0,0
Kritunga Restaurant,I had ordered chicken dum biriyani There is no chicken dum inside it also the chicken pieces are very small in size I would also suggest to work on your food packaging Very much disappointed with the quality of food ,1.0,0
Chinese Pavilion,The food was amazing Do not forget to try Mou chi Kay there Amazing sizzlers and very cordial staff You have got t to taste the Dragon chicken as well Best on town for Chinese ,4.5,0
Domino's Pizza,are we fool here to order cheese burst when we can eat a simple base pizza always disappointed with the cheese quantity,1.0,0
Royal Spicy Restaurant,Worst chicken biryani ever had in Hyderabad till now No salt less chicken pieces No taste nothing Even road side stall who sell biryani in 60 rs provide 100 times better biryani than this,1.0,0
Tiki Shack,This isn t a good place for food as there are no good options Also the staff doesn t feel like working when the customers are around They need to improve ,1.0,0
Chinese Pavilion, Delayedpost date of visit Jan 10 FoodShaukeen ChinesePavilion Chinese Pavilion was one place which was hiding in my wishlist for very long in Chinese category and this wish was fulfilled when a friend wanted to throw a party in a Chinese restaurant and I wasted no time in suggesting this Visited Gachibowli branch which is above CCD and is in the same building of Up the Bistro Their ambience does comply with their cuisine to most and their seating is quite comfortable and can seat up to 40 pax comfortably Pricing is a bit on higher end with most of the dishes are priced above 350 and very few are between 250 350 A tummyful meal could go up to 1400 for 2 AI Have ordered Manchow soup to start our meal which satisfied our taste buds Red Chilli Prawns dry BBQ chicken three treasure veggies and honey glazed potato balls were part of appetizers Prawns Teppan yaki pan fried and tossed along with Chilli Garlic and butter tasted real good BBQ chicken was a decent attempt and could have been more better Show stealer among appetizers was definitely honey glazed potato balls which were delicious with a punch of sweet and a little pepperish a wonderful combo to your taste buds Three treasure veggies had broccoli baby corn and mushrooms and felt more like a salad for me Had it been a little more pan fried with its sauces could have done wonders Among main course was schezwan fried rice and CP special noodles which is made of pan fried noodles and oyster sauce tasted Okish as sauce did not impress me as much as I expected Schezwan rice was delicious though right to the spices Requested for desserts and they dint have anything from their menu except honey noodles Service Though their service is quick staff is not so attentive to the customer for the ad hoc requests and also to take order Something that is important from customer point of view Bottomline there were few misses and few hits However most of the dishes were towards sweeter side I wouldnt mind another try here and see if my first visit is just an exception ,3.5,0
