Restaurant,Review,Rating,Label
Zega - Sheraton Hyderabad Hotel,Zega is a beautiful Pan Asian restaurant located amidst the lavish property of Sheraton Hyderabad The restaurant has got a great ambiance to it and serves some of the authentic Pan Asian dishes that one could ask for I went there for their ongoing Dimsum food festival with my pals and had a great time overall The Dimsum food festival had a variety of Thukpa options ranging from Chicken Mutton Pork and the veg version alongside some beautifully crafted dimsums inspired from China Next up there was an option for various wok tossed gravies and some delicious desserts The first thing to try out was their Chicken Thukpa It was simply delicious The broth was super special and it had a balanced proportion of sweet spice and tang into it which was amazing The amount of veggies and noodles were also quite balanced and overall it was an absolute winner This was something I personally recommend all of you to try Next up we were offered some of their Dimsums The showstopper of the day were Pan fried Chicken Gyoza Pok choi roasted garlic and Napa Cabbage Crystals Prawn crystal wraps and Vegetable beijing dumpling The Prawn crystal wraps had a tad sweet soy used as a sauce which could have had a slight more kick to it otherwise all these are a must try For mains we ordered for Wok tossed Chicken in Dry chilli cashews Crispy fish in chilli plum sauce along side Vegetable fried rice and Vegetable wok tossed soft noodles The Chicken in dry chilli cashwes was the clear winner of the lot and was simply wonderful It was a tad saltier in the first serving but we got it amended thanks to the chef Overall the main course was good and had clean authentic flavors With out tummies full and our satisfaction levels reached we decided to go ahead with their Toffee banana with palm sugar ice cream This was magical I have been a lover of Toffee banana but this fusion right here was mind blowing The creaminess of the palm sugar ice cream went on fantastically with the crispy banana toffee and was a big boost for our palate All in all it is a place to sit back relax and enjoy a great layout of Pan Asian food The staff is highly cooperative and seeks a lot of feedback which is a great thing Happy eating ,4.0,2
Over The Moon Brew Company,Went for quick bite with friends and loved the place People were supper friendly and the food was awesome We were so full Loved the chicken pizza Fish fry and Palak Tika Last but not the least the orange mocktail sorry don t remember the name was just awesome Great job OTM ,5.0,2
Paradise,Goodtaste ever paradise makes magic chefs will gladly prepare it the way u prefer They are nice to serve everyone this is the world best biryani ,5.0,2
Aromas@11SIX,This review was long due Located on the Khajaguda Road this restaurant claims to be part of the Gachibowli cluster and when I asked the owner he said he was just on the edge of Gachibowli and therefore technically they are in Gachibowli The place has good parking and nice natural setup which has still been maintained despite the recent road construction Coming to the food we went for the Gulaabi Chaap after checking on Google unfortunately this is the only place in India that offers this dish and we had no clue about the dish until we got it Simply put it was amazing mild rose smelling chicken cooked in the tandoor and served with mint sauce It gave a heavenly feeling Next on the list was the Chicken Momo which was soft and fresh again reminded me of some amazing momos I had in Manali I hope some day they make Mutton Momos as well Butter Chicken was by far the best in town which went very well with another amazing bread called the Malai Warki Paratha It was soft and was melting in the mouth with the Butter Chicken Seemed like a match made in heaven Much said about the main course we went for their version of Special Biryani As is known from my reviews I don t eat too spicy food and this was just the perfect spicy level one could ask for It had boneless pieces of chicken pan fried and served on top of the Biryani Rice The taste was good and to my liking Our Vegetarians friends were enjoying their Daal Makhni and Paneer Butter Masala which was again good and their Veg Biryani as per them was equally good Thanks to the friendly staff we went on eating for close to 2 and half hours without feeling the time passing by The large projector added to the aura of the place and we enjoyed the IPL on the large screen They offered us a 20 discount and another 10 on our next visit apparently one of their limited time running offer Thank you aromas 11six for being such a good host and an amazing food We shall be back again ,5.0,2
Zega - Sheraton Hyderabad Hotel,Hospitality by Mr Sai customised food by Chef Manisha and ambience made the dinner a perfect set I strongly recommend this place for Asian cusine and wonderful fine dine experience The support staff are very courteous and understanding they were very patient with my little daughter Many thanks for that ,5.0,2
Karachi Bakery,Hey Hyderabadiissss Everyone in Hyderabad have must visited this place A store of happiness with chocolates cookies cake pastries bakery Namkeen snacks and many more things Took away Osmania biscuits banana chips potato chips salted cookies Taste 4 5 Osmania biscuits MUST TRY long masala banana waffers MUST TRY Price 3 5 5 Service 4 5 Staff 4 5 Will give a next visit Ans ALWAYS when in Hyderabad,5.0,2
Jonathan's Kitchen - Holiday Inn Express & Suites,Went for a Sunday Brunch with family The spread is absolutely massive though veg options were limited especially Starters However the food itself is lip smacking good no matter what we tried The staff was courteous and always available to assist Ambience was nice though the live music was a little too loud for our liking ,4.0,2
Prism Club & Kitchen,The best place or rather I should the best pub in India I really enjoy my weekend parties here Whether its edm or bollywood or hiphop this place is a blast Ideal for any kind of parties DJ Rabz is the resident DJ who does a really great job in keeping our feet moving and never lets the impulse go down Keep it up Rabz and Prism ,5.0,2
Aromas@11SIX,This is the place you should be if you are treating your friends full meals without burning your pocket Everything we ordered was tasty and good quantity ,4.0,2
Collage - Hyatt Hyderabad Gachibowli,It was good to be there it is just near to my working place we went for buffet which was very good Server was attentive n eager to serve Thanks you ,4.0,2
Labonel,Okay so initially I thought it s quite expensive especially for the brownies But I had to try of course I took a risk of taking 2 boxes of assorted brownies for my friends Well in a nutshell they loved it and so did I Id not think twice about the brownies again Cheers ,4.0,2
Kritunga Restaurant,Nice delivery boy good communication Super,5.0,2
Diners Pavilion,Visited this restaurant on a Wednesday night and it was empty with only one table occupied Zomato gold confirmation was quick and we ordered a bucket of Budweiser which was offered at 700 6pints Ordered chicken peri peri pizza chicken chipotle skewers and chicken ceaser salad All three items were good and specially the pizza They undoubtedly serve one of the best pizzas in town Very soft thin crust and very tasty 5 stars for their pizza Chicken chipotle skewers were little chewy but tasted really good Ceaser salad was very good too Service by Aumit was appreciated Would love to visit again for trying their other items in menu ,4.0,2
Aromas@11SIX,Went to this place just because it s listed on Zomato Gold and I must say I am pretty impressed with the whole experience over there We have ordered Paneer Majestic nothing extraordinary about it was good Later we have tried Bhami Goreng Veg Kolhapuri Butter Naan and Murg Biryani Bhami Goreng had very unique different flavour taste which I liked Same thing with the curry and naan both of them were really good Special mention to Murg Biryani it was amazing Coming to prices they were pretty reasonable Ambience 3 5 Service 4 5 Food 4 5 Unfortunately no pics cause we were too hungry P,4.0,2
Green Bawarchi Restaurant,Food is good but not up to the mark and decor is not good at all Not suitable for family There is a A C on upstairs bit that also not that much hyganic,4.0,2
Prism Club & Kitchen,Awesome ambience superb music definitely a great and most happening place Bit costly place I feel and crowded as well Perfect place for friday evening party ,5.0,2
Marsala Food Company,Restaurant is having simple and good looking ambience Party type of seating Handi type of seating also available Coming to the dishes items are tasty and justifying quantity for the prices Staff were polite and prompt service we can observe Baby corn Manchuria and Dragon Chicken must try here But nite that we can t expect Hyderabadi styled biriyani here ,4.0,2
Olive Garden,Been here with my friends for my birthday party selected this restaurant based on the rating on zomato and it did worth the rating Food was very good and the cost worth the taste and quantity ,5.0,2
Chinese Pavilion,Really loved the ambience Staff was very polite Very delicious food served quickly though it was busy But very expensive when compared to other restaurants ,4.0,2
Royal Spicy Restaurant,Great food i love the ulvacharu biryani from here Ambience is alright but could be better taste wise awesome But most importantly prices are very competetive which makes it affordable ,5.0,2
B-Dubs,One of the best sports bar I ve been to in the country Their service and the hosting is impeccable The staff is super friendly and I couldn t have asked for a better place to spend my sunday here ,5.0,2
Mathura Vilas,We had south indian meal here food was amazing Loved drumstick n tomato curry Staff is very polite in dealing banana served with the meal is a bingo will try north indian thali too and other cuisines as well,5.0,2
Chinese Pavilion,I personally love and prefer Chinese Food Had been here couple of times with my husband The ambiance of the place is very good The entrance has some carvings and the walls were very nicely decorated The server was very polite When it comes to food this place does not disappoint This is a small comfy restaurant that is surprisingly not very crowded even on weekends We went there for our anniversary celebrations and it was just perfect No crowd we got the attention and service we were looking for ,4.0,2
Khaan Saab,Food 4 5 We had chicken Tikka biryani and mutton biryani Mutton biryani was really very good You will get the authentic Lucknowi style flavor Pieces were also very good Mutton biryani is a must try you would certainly enjoy it Service 4 5 They were very smooth in accepting the zomato gold Even the service was very good They were attentive and brought all the demanded things swiftly Ambience 4 5 It was good You will have the royal feel The plates n all were good The lobby had a big elephant and beautiful interiors ,4.0,2
Komatose - Holiday Inn Express & Suites,This place is love It s your everyday bar This place not just welcomes regular customers but make the leave a mark literally You ll find name plates of it s regular customers all over the bar And their bartenders absolutely know how to keep the customers happy This is one place where you will find more people sitting at the bar rather than the regular seating arrangement it has Sonu being their star bartender you ll find almost everyone calling him out for their drinks and he absolutely takes care of all his regulars with a smile We usually order a whiskey sour and sangria being our absolute favorite Accompanied by crispy corn and their signature pizza which is baked fresh out of their Jonathan s kitchen If you re a party animal you ll find this place a hit on Thursdays where they take their ladies night very seriously All drinks on the house I d absolutely recommend this place if you re looking for your next regular bar As the saying goes You should always be a regular for more than one bar and this should absolutely be on your list ,5.0,2
Pista House,Superb tandoori chicken Mint chutney is awesome Got free Goli soda as well with food order Loved the food quality and quantity and taste ,5.0,2
Being Hungry,Good,5.0,2
Chinese Pavilion,Had dinner here yesterday Went here without reading any reviews and were hence with no expectations very good place for veg Chinese They have got everything right Ambience service and most importantly food waiters were friendly enough to suggest items in menu basis our preference Courteous service and great food at reasonable price considering the portion size What else do you want ,4.0,2
NorFest - The Dhaba,Had the best dal makhani and butter chicken at this place in Hyderabad Located in SLN terminus on 3rd floor Not a big place but they serve amazing punjabi food at reasonable prices ,5.0,2
Frio Bistro,Really good food friendly staff The pork ribs are a must try The food was well cooked very well presented and the menu had a lot of interesting dishes ,5.0,2
Mazzo - Marriott Executive Apartments,Nice place to spend with family great ambience warm welcoming great ambience of restaurants smiley faces quick service by service staff we will definitely come back to spent more time and same will suggest to my friends and family members ,5.0,2
Prism Club & Kitchen,Probably the best pub I had ever visited in the city Very spacious and one doesn t feel suffocated in here unlike the other balocony terrace turned pubs here in the city Haven t tried much of food But I liked all the chicken starters very much except for chicken 65 Would definitely visit again ,5.0,2
Komatose - Holiday Inn Express & Suites,Been here on a weekend with friends as this is attached to JK Ordered a Red bull Grilled Murrel With Herb Rice and Dragon Prawns FYI I am a seafood lover Coming to the review of each Murrel was grilled to perfection the way I like it with some veggies Murrel is my favorite fish and it needs to be cooked perfectly to enjoy its taste and it was made too good this was served with rice and some veggies Coming to Dragon Prawns again perfectly cooked and made to perfection Komatose as a place is good to hang out with friends and enjoy after a tiring day weekend the staff here is friendly and moreover the managers are welcoming and helps you out on your selection according to your mood taste ,5.0,2
Amul,Amul Ice cream Tastes best I ve tasted many flavours from the menu Delivery is also cool with the dry ice covers the ice cream I must recommend to try all the flavours They have from budget to premium Ice cream ,4.0,2
Zing's Northeast Kitchen,One of the best places in and around Hitech City to have good food Price is very decent and main course portions are also very good Would surely come back again,5.0,2
Paradise,Very good hospitality good ambiance and very good food v good facility of packing biriyani to long distances good place to visit mainly for Hyderabad biriyani,5.0,2
Jonathan's Kitchen - Holiday Inn Express & Suites,Ambience very sophisticated Food in terms of variety its great We had continental Pastas Pizza are to die for Fish and chips were just ok nothing so great Desert cheesecake is a treat And frozen alaska was pretty bad 1 less star only for that ,4.0,2
10 Downing Street,Been here for lunch with 6 ppl Decent interiors nice and comfort seating Food is delicious Combo menu has great selection Loved Potato wedges corn and broccoli fermentino No options in desserts Food 5 5 Drinks 4 5 Ambiance 5 5 Staff behavior 4 5,5.0,2
Shanghai Chef 2,Recently I went to this place for a review session with bunch of freaks This place is located at indiranagar Service was really great When it come to chineese cuisine I thought to order few authentic dishes Firstly they served us with soup chicken manchow soup and tom kha gai gung which is coconut based People who likes coconut based cuisine then they must try this Coming to starters we ordered tai Pai chicken dragon prawns Kung Pao Phuket fish dumplings named shu mai Out of these best was Phuket fish which was crispy frm outside Main course They served us Burmese know suey again this is coconut based dish where the gravy is made out of coconut It s served with plain noodles add ons like peanuts fried onions green chillies variety of suaces Pad Thai rice which was just like fried rice They also serve mocktails and desert Fried ice cream was the best ,5.0,2
Cream Stone,Interior is good but small one and quality of ice cream also good but some of the items like chocolate u can t eat alone bcz of it Sweetness,4.0,2
Deli 9 Bistro,Overall a 4 5 experience This place has an nice warm ambience As their tower burger isn t available we have ordered Chicken Burger along with Lamb Pizza and Lasagne The burger was amazing the patty was so juicy and was perfect The pizza was also good The lasagne was a tad bit disappointing as it was felt grainy in the mouth but tasted delicious The service was very prompt Would love to visit this place again ,4.0,2
Paradise,Good food and the service of quality are very good and the ambiance and hospitality are amazing t I really enjoyed the food Judi busy bug birth Nick,5.0,2
The Indi Grill,This restaurant has got a good location and interior In The buffet menu the starters and grilled items are good but the main course need serious improvements Main course dishes are average and not up to mark I think the price is also quite high in comparison to its dishes ,4.0,2
B-Dubs,Awesome place to hand out with friends especially during IPL season The environment is awesome and the food is great There are a many games on PS4s and on VR Had an awesome time ,5.0,2
Deli 9 Bistro,The pasta alone is too good to fetch the high rating The service is another reason for it I would definitely like to have many more visits to try out other items in their menu card ,4.0,2
Shah Ghouse Spl Shawarma,Shawarma at Shah ghouse is very tasty I love to order it from Shah ghouse only Quantity of a shawarma at Shah ghouse makes your stomach happy ,5.0,2
NorFest - The Dhaba, This has to be my favourite Punjabi restaurant in Hyderabad During my short trip in Hyderabad I have tried food in many restaurants but this one was a scene stealer What I liked the most abt this place was the amazing food at such a reasonable price The taste was something that will crave you to have more and more even when you are full I visited this place with my friend without any proper planning our intention was to visit the pub in the same mall but we were too hungry and were not interested in eating in pub We wanted something heavy to get that energy to dance like crazy So we ended up in this restaurant It is located at the food court and has open seating facility We ordered the Punjabi Special VegThali 269 It was the most delicious Thali I ever had in life just divine and out of the world It comprises of the following Kadai Paneer 4 5 5 Paneer are usually always tasty in most of the restaurants but the gravy always lacks the taste I have the habit of just eating the paneer cubes and leaving the gravy But this one has the most tasty and delicious gravy Dum aloo 4 5 This was the veg of the day potatoes were peeled properly and were marinated nicely Just like paneer the gravy was something to lure for Dal Makhani 4 5 5 A Punjabi Thali is definitely incomplete without a Dal Makhani It is one of the most popular and loved dal in the northern part of the country The dal gets its taste and richness from the use of cream and butter in black lentils and red kidney beans It was super yummy and definitely the best dal makhani I ever had Bundi Raita 5 5 This one stole my heart I think words won t do justice for its great taste I never had such a tasty raita ever in any restaurant and trust me I eat out a lot I would have mind having 3 bowls of raita at one go coz it was this yummy The curd was fresh and the minimum spices used in it was adding the perfect flavour A big thumbs up for this dish Rice 4 5 The zeera basmati rice was definitely of the best quality It was big in size and was cooked so well Each rice piece was looking like a gem on its own Butter Tandoori Roti 4 5 It was soft buttery and definitely only made up of wheat without any hint of maida Salad 4 5 5 Fresh cucumber carrot and onion with a pinch of lemon is definitely makes the best salad in a Punjabi Thali Kheer 4 5 The perfect way to end a meal is by having a sweet dish and what can be better than kheer It was not overly sweet but the sugar was mixed in a way that will suit everyone The service was quick and they did not made us wait for more than 15 mins What I like most about the food was that the spices was added in a perfect way just to make it tasty they have not turned it into super spicy The quantity is good for one person although even two person can share it But I will suggest not to share as it is so yummy and tasty you will regret sharing even a single bite Surely try this outlet and you will thank me later Final Verdict Food 5 Ambience 3 Service 4 Value for money 5 Overall Rating ,4.0,2
Olive Garden,good,5.0,2
PourHouse7,Visited the clubbing section of the resturant must say ambience is too Good Visited for ladies and bollywood night and one of the most nice DJs i could say Coming to drinks and they lived upto expectations we order Chinken Nazakat and butter garlic prawns and they were exotic and tasty Finding these two too good went ahead with Fish Finger and kalmi Kabab They were good too to scale up i would say must visit it to enjoy it ,5.0,2
The Lal Street - Bar Exchange,I am absolutely in love with this place not much hyped but still crowded I recommend to visit on weekdays and weekends can get overcrowded Pizza was good so were the other titbits but what I liked most was there service took time to place the order at the POS but the bartender whipped up my drink in no second bad I never had to call out for a repeat it was ready each time Overall I go to this place every other week one of the best party place around ,5.0,2
Beyond Flavours,Staff are just polite and responsive Food is the best part here And it is better as ambience also awesome here I met two persons here named Papiya and Shuvro who are the best at their services Food items i liked here were Basket biryani and Kodi drum sticks Finally just loved ,5.0,2
Beyond Flavours,Ahmed was serving us Polite and very cooperative staff Amazing food and Ambience Veg gilaffi Kabab and Lasgna was a must try Loved overall experience ,4.0,2
Pakwaan Grand,Hmmm,4.0,2
Mazzo - Marriott Executive Apartments,Nice place to visit Food is good exception of biryani starters are preferable but it has an excellent view Pool view is quiet enjoyable and just awesome ,4.0,2
Paradise,Biriyani is good and provided a good service and ur restaurant was nice and looking goodBiriyani is good and provided a good service and ur restaurant was nice and looking goodBiriyani is good and provided a good service and ur restaurant was nice and looking good,5.0,2
Squeeze @ The Lime,i love your combos,5.0,2
Zega - Sheraton Hyderabad Hotel,Great ambiance and food Hostess Barnali is awsm She had helping us in choosing the food and she is so caring Overall a wonderful experience ,5.0,2
Karachi Bakery,They had a really amazing burger with a very different taste than usual Karachi crispy veg burger had a crispy bread and came with chips Must try,5.0,2
Club Rogue,A great place to hang out with your friends One of the best pubs in the city It s a little highly priced but overall the ambience music and food matches the bar Great food and great music Courteous staff and great service ,5.0,2
Owm Nom Nom,Best quality food with rich spicy taste in reasonable price biryani lovers you can try for special chicken price the staffs and manager is very coperative ,5.0,2
Pakwaan Grand,Very good delivery,5.0,2
The Fisherman's Wharf,Hi guys I went here as part of an office party So can t really comment about the Al Carte The ambience is really cool Full Marks to these guys for replicating Goa in such a great way The seafood variety is superb All in all this place is good for people who eat sea food The dj was also great We had loads of fun ,4.0,2
Barbeque Nation,Nice place very good food but main course should be be improved because starters 4 dessert 4 and main course 3 5 because food in main course was not upto mark need some taste build up,4.0,2
Biryanis And More,We had such delicious dishes every time we went here Spicy chicken statters Mutton biryani very good ambiance and much more The staff was very kind ,5.0,2
Dine O China,nice taste but very less quantity,4.0,2
NorFest - The Dhaba,Food is The USP All i tasted there was great But my favourite is the punjabi butter chicken with bone such aroma n taste m salivating while writing even the only thing is i feel it s a little burn in the pocket ,4.0,2
Cafe Eclat,Terrific experience Amazing place for breakfast brunch Loved the sour dough bread hazelnut latte french toast pan cakes etc One tiny suggestion is for you guys to serve more chocolate and blueberry sauce with the pancakes loved the time spent here ,5.0,2
Frio Bistro,1 star less for the bad look the server gave when we mentioned about gold Rest are for amazing food tiramisu and chocolate dessert best in the area,4.0,2
